,cate,product,cost,review_star,review,tag
0,Kitchen & Dining,"YETI Rambler 10 oz Lowball, Vacuum Insulated, Stainless Steel with MagSlider Lid",$15.00 - $67.28,5,"This is a great cup, and although it’s not 100% leak proof I would not expect that with lid styles like these. It does prevent big messes if accidentally tipped over but isn’t easy to tip over anyway. It feels good in the hand, looks smooth and durable and is great for any beverage you can think of.

Some of my favorite features are:

1. Mag slider, its awesome because I can remove it and thoroughly clean the lid. No trapped funk!

2. The press in lid. It’s a strong seal and no awkward thread aligning issues. Not too hard to remove and easy to clean! Keeps pesky cats out of my bedside water too.

3. The lip of the cup is smooth. I like drinking from the cup as much without the lid as I do with the lid.

4. it’s a good size, not too big that I wouldn’t want to put wine or a cocktail into it, and not too small for coffee or tea. I like a lot of coffee and tea and don’t mind having to refill this more often. My pour over fits over this perfectly too..

5. The copper color, while not bright copper fits in well with my decor, and looks classy.

6. Great insulation! I haven’t tested exactly how long things stay hot or cold but I did scald my tongue about an hour after making tea..

So take extreme caution with hot beverages!",positive
1,Kitchen & Dining,"YETI Rambler 10 oz Lowball, Vacuum Insulated, Stainless Steel with MagSlider Lid",$15.00 - $67.28,5,"I love these for cold drinks on a hot day. Haven't used it for coffee yet, but Fall will be here soon. I bought two for my family as a thank you gift for a stay at their home. Great gift idea!",positive
2,Kitchen & Dining,"YETI Rambler 10 oz Lowball, Vacuum Insulated, Stainless Steel with MagSlider Lid",$15.00 - $67.28,5,I love a YETI! The yellow is so darn cute and keeps my drinks cold. Brought these camping and the came in handy.,positive
3,Kitchen & Dining,"YETI Rambler 10 oz Lowball, Vacuum Insulated, Stainless Steel with MagSlider Lid",$15.00 - $67.28,5,The best feature is that it’s a yeti that fits inside a coffee dispenser like most office or pod systems. Most travel cups are too tall to fit.,positive
4,Kitchen & Dining,"YETI Rambler 10 oz Lowball, Vacuum Insulated, Stainless Steel with MagSlider Lid",$15.00 - $67.28,5,"I was recovering from 5 months in hospital with Covid. I was finally able to drink liquid again. This cup was the perfect size for the cold brew pods I found, it was easy to add the right amount of liquid. I would have the nurses fill the cup halfway with ice each night before bed, then in the morning I could add the coffee, creamer and water to make the perfect cup of iced coffee, and it stayed icy cold for hours as I slowly drank it. I still use the cup now, even though I am home and able to do everything I could before getting sick. It also keeps a hot coffee hot for hours.",positive
5,Kitchen & Dining,"YETI Rambler 10 oz Lowball, Vacuum Insulated, Stainless Steel with MagSlider Lid",$15.00 - $67.28,5,"Only thing I would change would be to make it a little narrower.
But it's an amazing cup, like all the Yeti cups I've seen so far.",positive
6,Kitchen & Dining,"YETI Rambler 10 oz Lowball, Vacuum Insulated, Stainless Steel with MagSlider Lid",$15.00 - $67.28,5,Great product like always. Worth the money every time.,positive
7,Kitchen & Dining,"YETI Rambler 10 oz Lowball, Vacuum Insulated, Stainless Steel with MagSlider Lid",$15.00 - $67.28,5,Every single product by this company is solid. This is a buy it for life sort of brand. Love these,positive
8,Kitchen & Dining,"YETI Rambler 10 oz Lowball, Vacuum Insulated, Stainless Steel with MagSlider Lid",$15.00 - $67.28,5,"We had these great tumblers in our vacation home and we fell in love with them. They keep cold things cold for hours. Beverages don’t get diluted because the ice doesn’t melt quickly. They are indispensable if you are outside and about.

After having them in our other home, we realized we needed them in our day to day house because who doesn’t want every drink to stay cold?",positive
9,Kitchen & Dining,"YETI Rambler 10 oz Lowball, Vacuum Insulated, Stainless Steel with MagSlider Lid",$15.00 - $67.28,5,Great little cup for camping,positive
10,Kitchen & Dining,THERMOS FUNTAINER 10 Ounce Food Jar,$11.88 - $39.38,5,"This thermo really works as described. The size is perfect for my child’s school lunch. It keeps the food warm until lunch. It does not leak, I tried sending her soup last week and there were no leaks at all. Highly recommend this thermo for kids who like to take hot lunches to school.",positive
11,Kitchen & Dining,THERMOS FUNTAINER 10 Ounce Food Jar,$11.88 - $39.38,5,Purchased this for my daughter to take her lunch to school in and it's great. She said her food is warm and ready to eat when lunchtime comes. It is leak proof and has a spoon for convenience!!,positive
12,Kitchen & Dining,THERMOS FUNTAINER 10 Ounce Food Jar,$11.88 - $39.38,5,I bought this for my youngest for lunch and I make his food around 7a and 4 hours later his food is always still hot or as he says still steamy when he opens it up. Currently buying another one for my oldest. Its great!,positive
13,Kitchen & Dining,THERMOS FUNTAINER 10 Ounce Food Jar,$11.88 - $39.38,5,Bought this thermos for my granddaughter’s lunches. She said her food was barely warm even after filling it with boiling water & letting it sit for 10 minutes before adding the food. Pack her lunch at 7:30 & she eats lunch at noon.,positive
14,Kitchen & Dining,THERMOS FUNTAINER 10 Ounce Food Jar,$11.88 - $39.38,5,This has been leak proof so far and has kept my child’s lunch warm when using. It fits perfect in his lunch box. Easy to clean and holds the spoon up top. My child is able to open it and shut it easily. Very happy with this product!,positive
15,Kitchen & Dining,THERMOS FUNTAINER 10 Ounce Food Jar,$11.88 - $39.38,5,I love it keeps the food hot for a long time. Advice is to pour boiling water in the thermo to activate first then put your food in there so it stays even hotter longer. Perfect size. Lost the spoon though and wish I can buy another but I don’t see any online.,positive
16,Kitchen & Dining,THERMOS FUNTAINER 10 Ounce Food Jar,$11.88 - $39.38,5,This product was great until the first wash. The seal would not stay in place and it would leak after first wash.,positive
17,Kitchen & Dining,THERMOS FUNTAINER 10 Ounce Food Jar,$11.88 - $39.38,4,"Great size and doesn't leak. My says the food is still warm when he goes to lunch. I ordered two more for my nieces. However, the labels were not included with any of the three that I ordered.",positive
18,Kitchen & Dining,THERMOS FUNTAINER 10 Ounce Food Jar,$11.88 - $39.38,5,Used it for keeping nuggets or toquitos hot until school lunch time. Perfect!,positive
19,Kitchen & Dining,THERMOS FUNTAINER 10 Ounce Food Jar,$11.88 - $39.38,5,My daughter likes that it keeps her lunch warm. I enjoy the ease of cleaning the thermos and that the spoon is included. Now I know she won’t skip lunch.,positive
20,Kitchen & Dining,"Bentgo Kids Prints Leak-Proof, 5-Compartment Bento-Style Kids Lunch Box - Ideal Portion Sizes for Ages 3 to 7 - BPA-Free, Dishwasher Safe, Food-Safe Materials",$28.99 - $35.99,5,I bought several bentgo and other products for my 4 year old that was starting TK. First she loved this design which was fun and very girlie which she loves. So far it has shown to be leak proof and very easy to wash. The portions are perfect because she would leave some uneaten food before I started using this but with this she either eats everything including snack time and if she leaves anything it’s very little food. I also liked that this wasn’t as heavy as other similar products and easy for her to open and close. I would buy more in the future and would recommend to others.,positive
21,Kitchen & Dining,"Bentgo Kids Prints Leak-Proof, 5-Compartment Bento-Style Kids Lunch Box - Ideal Portion Sizes for Ages 3 to 7 - BPA-Free, Dishwasher Safe, Food-Safe Materials",$28.99 - $35.99,5,"We've been using Bentgo Kids boxes since my daughter went to preschool and love them. She is an extremely picky eater and it's a good format for her to use - big section for a protein and grain, small sections for fruit, veg, healthy fat (olives usually) then she gets to put a ""dessert"" in the sauce cup (a gummy worm or a few m&ms). In the 5 years we've used them we've purchased maybe 12 boxes - the seals do wear out after a year or 2, but I put them in the dishwasher so that's mostly on me.",positive
22,Kitchen & Dining,"Bentgo Kids Prints Leak-Proof, 5-Compartment Bento-Style Kids Lunch Box - Ideal Portion Sizes for Ages 3 to 7 - BPA-Free, Dishwasher Safe, Food-Safe Materials",$28.99 - $35.99,5,"I was on FaceTime with my granddaughter, when she opened her bento box and the smile and big hug she gave to it after seeing it was just for HER made my heart melt! She loves the little unicorns (of course!) but I think it was especially warming because over the past week everything was about her brother starting school and she was being left behind. So when I sent his bento box for his school lunches, she looked on disinterestedly, but then SHE got one and everything changed. She was so happy! I could tell it meant a lot to be remembered.
I like it bc she can now feel special at her OWN lunchtime, nothing will leak out since each compartment is sealed, and it’s just the right size for different sized foods, and if she wants to eat out at the park in the Texas heat, at least I know it will keep things the same temp they were packed in. A cool pack could be added too for longer hours.
I just enjoyed her reaction. Consider getting one to make someone you love feel great!",positive
23,Kitchen & Dining,"Bentgo Kids Prints Leak-Proof, 5-Compartment Bento-Style Kids Lunch Box - Ideal Portion Sizes for Ages 3 to 7 - BPA-Free, Dishwasher Safe, Food-Safe Materials",$28.99 - $35.99,5,"This is my third Bento box I’ve purchased for my 5yo son. Not because anything is wrong with the previous two, but because these are my favorite when it comes to packing his lunch. He’s not a real “hungry kid” so large portions aren’t his thing. He would rather have a large variety than quantity. Bento is perfect for that! They don’t leak, he can open and close it easily, and they’re dishwasher safe. I suspect in the near future I’ll acquire two more so we have one for every school day!",positive
24,Kitchen & Dining,"Bentgo Kids Prints Leak-Proof, 5-Compartment Bento-Style Kids Lunch Box - Ideal Portion Sizes for Ages 3 to 7 - BPA-Free, Dishwasher Safe, Food-Safe Materials",$28.99 - $35.99,5,"The lunchbox works great, is leakproof, perfect size for my toddler, and is easy for my 3 year old to open on her own. She also loves the print, and has taken to carrying her lunchbox around the house. I also tried to convince her to order lunch at preschool a couple times and she tells me “no I just want my lunchbox”. My husband and I joke about it being her emotional support lunchbox",positive
25,Kitchen & Dining,"Bentgo Kids Prints Leak-Proof, 5-Compartment Bento-Style Kids Lunch Box - Ideal Portion Sizes for Ages 3 to 7 - BPA-Free, Dishwasher Safe, Food-Safe Materials",$28.99 - $35.99,5,"Our five year old is quite the picky eater. Variety is not one of our strengths right now. Getting him involved in packing his lunch has helped somewhat. And the fact that he LOVES the graphics and Bentgo, in general, is awesome! This summer is his first experience with summer camp and he’s required to send a lunch each day. After doing some research on our options and talking to some other parents, I decided to spend a little more and purchase the BentGo and coordinated lunch bag. Knowing he’s not going to be a huge fan of school lunches, camp gave us an opportunity for a trial run. So far, he’s only allowed two combos: ham sandwich with pringles, berries, spinach leaves and ranch; and chicken nuggets with ketchup, Mac and cheese, and berries. The cold foods have been fine with the little rocket ice packs in the bag. He said the Mac and cheese and nuggets got too cool. (But he still ate it all. 🤷) We haven’t tried anything liquidy other than the ranch and ketchup, but they both stayed put without leaking into any other compartments.
Finally, clean up is easy. I haven’t put the removable tray into the dishwasher, but hand washing both pieces is quick and easy. We will definitely be looking into other items made by the same company.",positive
26,Kitchen & Dining,"Bentgo Kids Prints Leak-Proof, 5-Compartment Bento-Style Kids Lunch Box - Ideal Portion Sizes for Ages 3 to 7 - BPA-Free, Dishwasher Safe, Food-Safe Materials",$28.99 - $35.99,5,"It took a lot of going back and forth with all different types of lunch boxes/bento boxes to pick for my daughter’s lunches. I’m so glad I picked this one! She’s in 2nd grade and it is a perfect size. She’s also loving it! I make sandwiches for her usually, and cut them into two or fours, with some fruits and crackers and/or chips, and maybe a little treat.",positive
27,Kitchen & Dining,"Bentgo Kids Prints Leak-Proof, 5-Compartment Bento-Style Kids Lunch Box - Ideal Portion Sizes for Ages 3 to 7 - BPA-Free, Dishwasher Safe, Food-Safe Materials",$28.99 - $35.99,5,"My 3 year old loves her Bentgo boxes! (We have 6 of them!?) They are the perfect size for us! Typically a 1/2 sandwich, pasta or rice with chicken in the big spot, cheddar bunnies, strawberries and blueberries in the smaller spots and 2 animal crackers for dessert in the dip spot… b/c she’s not a dipper! They are easy to clean and I love removal tray. Sometimes she needs to eat on the go and the tray is perfect for car seat lunches!

Finally, my product got some mold that I wasn’t able to remove and they sent me a new box! It was easy and I LOVE LOVE LOVE great customer service! They also gave me tips for avoiding this issue in the future… which was user error to be honest. Make sure not to leave food in there overnight or use Goad Press and Seal for easy clean up!

Buy this and many more, you won’t be sorry!",positive
28,Kitchen & Dining,"Bentgo Kids Prints Leak-Proof, 5-Compartment Bento-Style Kids Lunch Box - Ideal Portion Sizes for Ages 3 to 7 - BPA-Free, Dishwasher Safe, Food-Safe Materials",$28.99 - $35.99,5,This was the second of 3 bentgo boxes we have purchased. My daughter has used these for school for 3 years now. They hold up so well. Plenty of space. NO leaking which is amazing and the patterns are so cute which is a huge plus. We will keep buying a new one each year! We also get the bag that matches!,positive
29,Kitchen & Dining,"Bentgo Kids Prints Leak-Proof, 5-Compartment Bento-Style Kids Lunch Box - Ideal Portion Sizes for Ages 3 to 7 - BPA-Free, Dishwasher Safe, Food-Safe Materials",$28.99 - $35.99,5,"I purchased this lunchbox for my 3-year old daughter (who is not the gentlest when it comes to products) last year and it’s still in good condition. It didn’t leak, even when we packed apple sauce for her lunch. As we prepared for her to enter PreK4 this year, we noticed that the sealing liner on top of the lunch box was starting to fray and although it wasn’t leaking, we called Bentgo to inquire about a replacement sealing liner. After explaining the issue and sending in pictures they notified us within a day that they would be sending a replacement lunchbox within the next 2-5 business days. They really stand behind their product and warranty and their customer service is great!",positive
30,Kitchen & Dining,THERMOS FUNTAINER 12 Ounce Bottle,$12.10 - $38.40,5,"These are the only sippy cups that legitimately keep drinks cold and milk from spilling in my car. My car does not smell like a milking parlor gone rogue anymore! They fit perfectly in car seat cup holders and stroller cup holders (Sorry Contigo, you know I love you!). Plus the handle is nice to strap onto a carabiner and hook to a bag or purse. Great for little hands with great themes. The only thing I don’t like is the graphics come off within a year, but I guess it means they are well loved and washed regularly 👍🏻",positive
31,Kitchen & Dining,THERMOS FUNTAINER 12 Ounce Bottle,$12.10 - $38.40,5,"Got 2 of these- one for my 2.5 yo and one for my 10 month old. They both use them with ease! The bottles keep water cold for long periods of time, the straw is very easy to get water out of, holds up in the dishwasher, and also holds up to being dropped repeatedly (accidentally because, toddlers LOL). Way better than some other stainless steel bottles we have. My toddler nephews have this same type (but they have the fun printed ones) and they also love them. Can’t wait to use them at the zoo and Disney World. Highly recommend.",positive
32,Kitchen & Dining,THERMOS FUNTAINER 12 Ounce Bottle,$12.10 - $38.40,5,"We’ve been using funtainers since my kids started school. They hold up super well despite drops, they don’t leak, and they’re easy for young kids to open and close. I’ve had the same ones for years, I just occasionally buy new straw replacements for them. One tip- Mine were leaking for the longest time and I couldn’t figure out why. Make sure when assembling you pull the straw (that you drink out of) up really hard. It will kind of pop. That stopped it.",positive
33,Kitchen & Dining,THERMOS FUNTAINER 12 Ounce Bottle,$12.10 - $38.40,5,I got this on a back to school sale and it's is amazing! My daughters drink is still cool when she gets home in the afternoon. It holds the perfect amount to last all day. No leaking! Easy for her to open and close and the handle on top is a huge plus!,positive
34,Kitchen & Dining,THERMOS FUNTAINER 12 Ounce Bottle,$12.10 - $38.40,5,"Bought for my kindergartener. Super easy to hold and pops open with the hit of the button. Son says looks really cool. He loves it. Fits nicely in his lunch box and side pocket of back pack. My 2yr olds often snatch, run off with and sometimes throw it as hard as they can. Seems to still be holding up perfectly. Very easy to clean. No leaks so far.",positive
35,Kitchen & Dining,THERMOS FUNTAINER 12 Ounce Bottle,$12.10 - $38.40,5,"My little one has a slight tongue thrust. Since this has a straw mechanism and not a sippy cup style spout, it promotes an appropriate swallow and tongue posture. Over the last 6 weeks we’ve incorporated some oral motor work to also address this issue and it is resolving. I am also a pediatric speech therapist.

The container only leaks when you hold it upside down, as my daughter likes to do so the water will drip into a container of her choice for her to play. Great container. I recommend it to my colleagues and clients.",positive
36,Kitchen & Dining,THERMOS FUNTAINER 12 Ounce Bottle,$12.10 - $38.40,5,"Great for my two year old! Works great outside of the fact that it DOES leak when lid is open. Otherwise it is SO cute, sturdy, easy to clean, and easy to carry.",positive
37,Kitchen & Dining,THERMOS FUNTAINER 12 Ounce Bottle,$12.10 - $38.40,5,"This is my favorite kid's water bottle. It keeps water and ice cold for hours. Perfect for walks, games, and theme parks. Fits in most kid's backpack side pockets. The handle is great and the pieces all come apart fairly easily for washing. I have another brand that is near impossible to remove the silicone pieces from the plastic lid.",positive
38,Kitchen & Dining,THERMOS FUNTAINER 12 Ounce Bottle,$12.10 - $38.40,5,"Originally found this at another store by me. It’s my second one I’m buying for my almost 2 year old. It’s really easy to clean AND thank you Thermos for selling the replacement straws!!!! Even with water inside, it’s not too heavy for my almost 2 year old to hold herself. She can also open and close the top by herself. I like the straw is clear so you can tell if inside of the straw is not clean and when it’s time to replace. I had the other one for a while and no rusting in the inside too. Nice product for toddlers too.",positive
39,Kitchen & Dining,THERMOS FUNTAINER 12 Ounce Bottle,$12.10 - $38.40,4,"The source of the smell is the silicone. Its really strong plastic smell. I leave it in scalding water, I use soap , it wont go away.

I bought the plain blue from amazon. I bought the mario from walmart

They have these at walmart and i did not have this problem. They are same brand. Thermos funtainer although the lids are different.",positive
40,Kitchen & Dining,"Bentgo Deluxe Insulated Lunch Bag - Double Insulated, Durable and Water Resistant Fabric with Interior and Exterior Zippered Pockets and External Water Bottle Holder- Ideal for Children",$24.99 - $35.50,5,"We have for YEARS used the pottery barn kids lunch boxes because my oldest loves the matching patterns for her backpack and lunchbox and liked getting her name on it. This year we dropped the ball and didn’t order in time so she had the option of getting her normal pottery barn things after the start of school, or getting something different so she chose to get something different this time.

After years of trying to put our bentgos into the PB lunchboxes and having zero extra room for a water bottle or juice box or anything, so I’d end up SHOVING her water bottle into the side water bottle pocket and she could never get it back in after lunch. This lunchbox is amazing. I can fit her bentgo (she uses both the kids version and the bentgo fresh) with a juice box or water bottle inside and another snack, with 2 cold packs. And even if I had to add more than that, the water bottle pocket is a soft mesh with a drawstring bungee so it’s SO easy to get bottles in and out.

The normal handle has a clip so you can clip it on a backpack (a feature we thought we’d miss from not having the PB lunchboxes, so we love that) and it also has the front handle so you can carry the lunchbox flat, so if you have a bento inside, the stuff won’t get as sloshed around and stuff. Sooo nice.

Not to keep comparing it to PB, but that’s what I have to compare it to. I am BLOWN AWAY by the quality compared to PB. You can tell just by touching it, the material is nicer and will hold up much longer, the handles seem better made, and the insulation is DRASTICALLY better, like it makes me actually sad I spent almost $50 each time I got one of those stupid things and just spent $24 on this or whatever the price was, and it’s so much better.",positive
41,Kitchen & Dining,"Bentgo Deluxe Insulated Lunch Bag - Double Insulated, Durable and Water Resistant Fabric with Interior and Exterior Zippered Pockets and External Water Bottle Holder- Ideal for Children",$24.99 - $35.50,5,"This lunch box will *barely* fit a PlanetBox Rover. You need to put the back edge of the rover in first, then gently pull the front corners of the lunch box out to settle the front edge in. If you can train your kid to do this, it'll probably work great for school. If your kid isn't patient enough and just jams it in, the edges of the rover are likely to tear up the inner silver liner of the lunch box. Other than the tight fit, this thing is gonna work like a dream. (Fingers crossed it may stretch some as the school year goes on.) Nice and sturdy. Good insulation. Lots of carry options. Space for an ice pack and some extra snacks, and the drink carrier on the side. I'd love to see it 1/4"" bigger all the way around, but this was the best solution for our rover that I've found besides the overpriced bag you can get straight from PlanetBox. If you own a Bentgo box, you're definitely gonna love this thing since the spacing will be better.",positive
42,Kitchen & Dining,"Bentgo Deluxe Insulated Lunch Bag - Double Insulated, Durable and Water Resistant Fabric with Interior and Exterior Zippered Pockets and External Water Bottle Holder- Ideal for Children",$24.99 - $35.50,4,This bag is great. Does the job and arrives as pictured. However it does not fit a lunch box and snack box (all of same brand and line). We can squeeze it all in but it makes zipping a bit more challenging for a 5 year old. It seems illogical that the same brand wouldn’t make a bag to fit their own products. We bought this specifically so that everything would fit. Also the outside of the bag had a few clips that look like they would work with a strap but no such strap came with it. A feature I would suggest adding to future models is a smooth name tag area where a sticker tag will attach properly. We added one to the inside and we will see how long it stays on.,positive
43,Kitchen & Dining,"Bentgo Deluxe Insulated Lunch Bag - Double Insulated, Durable and Water Resistant Fabric with Interior and Exterior Zippered Pockets and External Water Bottle Holder- Ideal for Children",$24.99 - $35.50,5,"My daughter just loves Flamingos, so she was happy to find this lunch bag. It is a good size bag, larger than most but still fits in her school backpack. It has a long strap to wear over your body or can be taken off of handheld is better. It also has a pull sting bottle holder on the side. The lunch bag can also be clipped to another bag or backpack.",positive
44,Kitchen & Dining,"Bentgo Deluxe Insulated Lunch Bag - Double Insulated, Durable and Water Resistant Fabric with Interior and Exterior Zippered Pockets and External Water Bottle Holder- Ideal for Children",$24.99 - $35.50,5,It's larg enough to fit the bento box and more. It also has a nice pouch on the side for a drink. It also has zipper on the outside for an ice pack to keep food cool. It is a bit bulky and heavy. It was perfect for my 7 year old but perhaps to heavy for my 4 year old.,positive
