,cate,product,cost,review_star,review,tag
242,Kitchen & Dining,"DASH Mini Maker for Individual Waffles, Hash Browns, Keto Chaffles with Easy to Clean",$11.10 - $29.99,5,"I am using this on a small(ish) off grid solar powered system, coming in at a tidy 350 watts it does not stress my power system in any way, it doesn't even make the lights dim (that are on the same circuit). I believe that most people who live off grid or are doing the van/bus life or RV/camper and use batteries to power their stuff should be able to run this with no problems. I bought a similar small mini electric waffle maker from a major dollar store thinking it would be the same, but it was 600 watts, I returned it and will buy another Dash waffle maker because it's only 350 watts.

OK, now to the machine, I bought this to try the chaffle thing, my hubby and I have made some life changes to our health and wanted something that would make healthier foods for us to eat, I had heard of chaffles but wasn't interested until now. Well, I wish I had jumped on the bandwagon when I first heard about them, I have had so much fun making all different kinds of chaffles and waffles.

I mainly do the egg and cheese ones, but have wandered out into some fun territory using healthier flour, my current fav is an organic sprouted whole wheat flour, I also like to add ground flax seed meal. Oh and for flavor, I discovered Chef Paul Prudhomme's Magic Seasoning Blends ~ Pizza & Pasta Magic Herbal, that makes my chaffles become pizza flavored!

But the biggest news about the Dash mini waffle maker in my house is my hubby is actually using it! This man does not cook, he will tell you himself, he will go hungry before cooking, yet he has been making 2-4 chaffles most everyday, I have had to start buying eggs by the flat since a dozen or 18 packs just don't last very long.

We have been making cheesy egg chaffles and other kinds for bread replacement, I have even bought fast food burgers and brought them home so that I can replace the bread with my homemade bread replacement.

If you are thinking about this, I'd say go for it! It doesn't take up any space, it is lite on power consumption, cooks fast... check YouTube for recipes, tips & tricks, inspiration and the such.

Edited to add: I stepped on a scale over the weekend and discovered to my delight that I had lost a few pounds, probably close to 5 or possibly more. I do intermittent fasting and typically eat one meal a day, the only thing I have changed is not eating bread or bread products anymore, since I eat OMAD it's pretty easy for me to know what I'm consuming, I tend to eat what I want in the amount I want during my eating period, this has helped me to transition away from bread, it's seems to be helping me.

The only thing I can say about this that could be a negative is I noticed that it seems to drain out a tiny bit of oily water from the bottom after use (especially heavy use), I think it's from the steam/water vapor that happens while it's cooking, it manages to get inside the unit and eventually will drain out onto the counter, this isn't from an overflow of product, it's actually coming from the inside. I will often, when I'm done using it, while it's still hot/warm, open it and turn it over onto a paper towel to drain anything that is on the inside. I'm not sure what could be done about this on the manufacturing level, perhaps make it more sealed so that nothing could get inside. It's not a big enough deal to stop me from using it or wanting to buy a second unit. I just discovered there is a tiny drain hole on the bottom of the unit next to a screw hole.",positive
243,Kitchen & Dining,"DASH Mini Maker for Individual Waffles, Hash Browns, Keto Chaffles with Easy to Clean",$11.10 - $29.99,5,"I did full blown Keto for 6 months and while I did lose body fat, I also gained visceral fat when I had ZERO before (and I did clean Keto, too!), so I no longer worry about staying in Ketosis, but I do find that a lower carb lifestyle is optimal for good health and body comp., so I'm always looking to cut carbs where I can. I tend to stay between 50-80g of carbs per day and that is a happy place for me. I bought this cute little waffle maker to help me keep it that way! Pictured is a turkey club I made with chaffles from this little wonder. It's a pretty basic appliance, but it does the job perfectly well for my needs! Also pictured is one of my favorite breakfasts which is a little waffles sandwich I make.

My chaffles recipe is:
1/2C shredded mozarella
4 TBS egg whites (you can use a whole egg but egg whites also work just fine and make it taste less ""eggy"" to me)
2 TBS almond flour
1/2 tsp Psyllium husk powder
1/4 tsp baking powder
+ whatever seasoning I feel like adding in the moment

I heat this guy up about 5 minutes until it's good and hot, then pour about 1/4 C of the batter in (don't over do it!) and cook until brown and crispy, about 3-4 minutes. You can tell when it's done without opening the lid if you no longer see steam coming out the sides. I highly recommend letting your chaffles sit for a couple minutes to cool after removing them from the iron as it will help them crisp up a bit more.

Breakfast waffle sandwich recipe:
1/3C sprouted spelt or oat flour
1/3C low fat greek yogurt
3 TBS cage free egg whites
1/8 tsp baking powder
1 tsp vanilla extract
2-3 TBS granulated monk fruit to taste
*Between 2 waffles I put a tablespoon each of lite sour cream and Nature's Hollow sugar free jam

These waffles take a little longer to cook through than chaffles.

I can definitely recommend buying one of these if you eat Keto or low carb and like chaffles to replace bread or if you're like me and make a lot of meals for one!

I sincerely hope this review has been helpful to someone else! And yes, I paid full price for it. Feel free to ask any questions!",positive
244,Kitchen & Dining,"DASH Mini Maker for Individual Waffles, Hash Browns, Keto Chaffles with Easy to Clean",$11.10 - $29.99,5,"Perfect little waffle maker for the kids, the grandparents or just for fun - we haven't stopped making all kinds of waffles since we got it! Super easy to use and to clean up; also got the book on making mini waffles with it and the possibilities seem endless now. !Even Dad loves it cause he can have his bacon and cheese waffles without having to make a whole full-size one. Definitely recommend for anyone who doesn't want to drag out the full-size waffle iron - would be ideal for a college student too. Love it!",positive
245,Kitchen & Dining,"DASH Mini Maker for Individual Waffles, Hash Browns, Keto Chaffles with Easy to Clean",$11.10 - $29.99,5,"There are few items on Amazon for under $10 that are as fantastic as this mini waffle maker. My Wife and I absolutely love it, as does our Little Girl. And what's not to love about it? It makes perfect Eggo-sized waffles, in record time. I do have a few quick suggestions for anyone that's interested in getting it, as well as one terrific hack for using this waffle maker that will be a real game-changer for breakfast and desserts. First off, how to use it....

We use Krusteaz Belgian waffle mix, although just about any waffle or pancake mix will do. We recently got a KPKitchen batter dispenser for pancakes and waffles, which makes it easier to get just the right amount of batter into the waffle iron each and every time. The easiest way to ""grease"" the waffle maker is to simply do a quick spray of Pam on each hot plate before you start making them. If you want waffles that are soft on the outside, spray between each waffle made. If you like a golden brown, slightly crispy/crunchy texture to your waffles, you only need to use the cooking spray once. Stick to using silicone and similar spatulas (avoid using metal utensils) to remove the waffle when it's finished. What's terrific about the size of this waffle maker is that if you have a leftover waffle or two after eating, you can simply stick them in the fridge or freezer for later, and pop them into your toaster (something you can't do with regular-sized waffle makers). Okay, now to the really cool part....

You can make the most amazing waffles with this thing using just canned cinnamon rolls. Without everyone having to wait forever for cinnamon rolls to be baked in the oven. Get a can of the Pillsbury cinnamon rolls with cream cheese icing. Now you can use the icing as-is, but you can make it ""pourable"" by adding a few ingredients. Just whisk/stir the included cream cheese icing with a cup of powdered sugar, three tablespoons of milk, and a teaspoon of vanilla. Once it's smooth, set it aside. When the waffle maker is hot and ready, stick one cinnamon roll directly in the center of it, and close the top firmly. What's going to happen is that it will slowly rise, the top will slowly move up as well. Grab the ""handle"" for the top and firmly press it down a second time. What this does is not only flatten the roll to completely fit the circle of the waffle iron, but ensures that it stays flat and baked through. You can eyeball and it and tell when it's made to your liking, I've found that it takes just slightly longer to make a cinnamon roll waffle than a regular waffle made with batter. Before each waffle is served, drizzle your cream cheese glaze over it. Not only do you have an amazing waffle with a taste like none other, but you don't need any type of pancake or waffle batter on hand. I experimented and also made Pillsbury orange rolls with orange icing, they were fantastic. Just remember, the key to making perfectly round cinnamon roll waffles is to close the lid not once, but a second time as the roll starts to rise in your waffle maker.

There are plenty of things you can buy for ten bucks. But instead of spending ten bucks on fast food, or two iced coffees, invest it something that you'll actually use often. And when you order one of these, you'll definitely use it often. Breakfast waffles. Piping hot cinnamon roll waffles topped with a scoop of vanilla ice cream for dessert. Fried chicken and waffle sandwiches. Your only limit is your imagination. You can do what I did, read plenty of reviews, and then decide to order it. Or you could just see for yourself how great it works, it's only $10. Go ahead and add it to your shopping cart, you'll be glad you did.",positive
246,Kitchen & Dining,"DASH Mini Maker for Individual Waffles, Hash Browns, Keto Chaffles with Easy to Clean",$11.10 - $29.99,5,"We use this little waffle maker for our son. He loves the heart shape waffles and it's easy to use for all of our family members. The recipe book gave us some great ideas for different waffles and they have all turned out well. My favorite is the mashed potato waffles and we have been able to sneak in some protein powder into the waffle mix for the kids.

Side note: The waffles are small and you can only do one at a time so we are not using this make family meals but it is perfect for a quick plug and play breakfast for one or two individuals.",positive
247,Kitchen & Dining,"DASH Mini Maker for Individual Waffles, Hash Browns, Keto Chaffles with Easy to Clean",$11.10 - $29.99,4,"Got this to make Chaffles of course. Everyone is. Easy to overfill and cause a mess on the counter. I find that I have to use a butter spray in between each waffle or chaffle I make if I am making more than a couple. The butter spray gathers at the back of the maker and will pour out all over the counter if you tip it. I put a doubled up paper plate under it while cooking to catch the oils or Grease coming out. I saw that they have a new improved version, with a cleaning tool and new non-stick iron on the inside of the waffle maker. Will probably get one of the newer versions and see how it does. If you are just making a couple chaffles, it does the job. Just don't overfill it.",positive
248,Kitchen & Dining,"DASH Mini Maker for Individual Waffles, Hash Browns, Keto Chaffles with Easy to Clean",$11.10 - $29.99,5,"My daughter likes using it to make weird concoctions that have nothing to do with food, marshmallow and chocolate waffles with added things she finds. It's fun to let her explore in the kitchen. I have used it for waffles they come out a big soggy but maybe it's the mix I'm using. Good purchase",positive
249,Kitchen & Dining,"DASH Mini Maker for Individual Waffles, Hash Browns, Keto Chaffles with Easy to Clean",$11.10 - $29.99,5,I bought this to make chaffles because I am eating a ketogenic diet which is low carb. There are so many good recipes requiring this tool. I'm really surprised at the versatility and many uses whether you eat low carb or not. It's a great buy.,positive
250,Kitchen & Dining,"YETI Rambler 20 oz Tumbler, Stainless Steel, Vacuum Insulated with MagSlider Lid",$31.00 - $274.99,5,"If you're like me you might be confused by all of the 1 star reviews saying these are counterfeit and not leak proof.

To begin with, you'll see one of the pictures I attached shows right on the sleeve that comes on the cup ""splash resistant to stand up to speed bumps and on the go carrying"". So yes, splash resistant is not equivalent to leak proof. This lid will probably leak if you intend on throwing this into a bag like you would a thermos with a screw on lid.

Second, lots of reviews saying these are counterfeit and made in China. If you Google ""is yeti made in China"" the first thing you'll see from their own website says their ramblers are indeed made in China. The bottom of the cup says designed in Texas, made in China. That doesn't make this counterfeit. In fact, you can see the Yeti symbol is stamped into the steel on both the bottom and side. So if this is counterfeit someone went to an insane length to pass these off as legit. Also, it came with all of the inserts and whatnot from Yeti. Along with a sticker. If this thing is counterfeit it's the most elaborate counterfeit of all time.

Lastly, I saw a lot of reviews saying they didn't get the right lid. Maybe so but I got a mag lid with mine. I wouldn't worry much about that. Probably a packaging mistake for those that happened to.

So in closing, I feel very confident in saying if you want this you can safely ignore the 1 star reviews that mention being counterfeit or not being leak proof.",positive
251,Kitchen & Dining,"YETI Rambler 20 oz Tumbler, Stainless Steel, Vacuum Insulated with MagSlider Lid",$31.00 - $274.99,5,"I always thought the hype around Yeti’s were just that, hype. I didn’t get it. Well, my company ordered a bunch of travel mugs from them with the company logo and I loved it! My mom loved it too and didn’t give it back! Lol

So, I purchased the bright pink 20 oz rambler for her birthday. Unfortunately, the “magslider”, used to close the mouth opening, was missing. I contacted Yeti, they apologized, and set a replacement “magslider” via next-day air. No questions asked!! I couldn’t believe it. I made the picture on Amazon, but Yeti customer service was assisting me.

Yeti, you have an excellent product and I will continue to support you. Thank you for the excellent customer service.",positive
252,Kitchen & Dining,"YETI Rambler 20 oz Tumbler, Stainless Steel, Vacuum Insulated with MagSlider Lid",$31.00 - $274.99,5,"Super, ultra happy with my Yeti tumbler!!! :-D I've never had an insulated mug or tumbler before, so I can't compare it to other brands. I was in the US visiting, and space/weight in my suitcase was limited, so I had to make it count; decided to go with a top brand right away, instead of trying a cheaper brand and risking it not being as good, or not lasting as long. So far I'm really happy!!! The alpine yellow color I chose is pretty and so uplifting. I wasn't sure about the exact model, so I chose the 14oz mug and also this 20oz tumbler. I do enjoy the mug best; I use it on my work desk, and I don't have to worry about knocking it over and making a mess. But this tumbler is awesome for the occasional hot tea around the house, and also for taking tea/coffee on the go (the mug would not fit in the holder on my car). The size is perfection, not too small and not overly large. Nobody ever mentions this detail, but the spot where I place my lips is super important; it cannot be too thin, or stay hot - it just needs to feel right, and this one does it for me. I gave it 4 stars for 'leak proof' because it's not meant to be totally leak proof, but I haven't yet make any messes carrying it around with the lid closed. I also gave it 4 stars for 'easy to carry'; yes, it fits very nicely in my hand, but I would have loved the option of a handle without having to pay extra. Highly recommended!!!",positive
253,Kitchen & Dining,"YETI Rambler 20 oz Tumbler, Stainless Steel, Vacuum Insulated with MagSlider Lid",$31.00 - $274.99,5,"Others have commented - It's NOT leakproof - not supposed to be. If you want a Yeti that's leakproof they make them too. Does a SUPER job of keeping drinks hot or cold for a long time - will keep ice for hours. Bought this one for my wife as she kept trying to steal mine. They have a great selection of colors and it's easy to clean as the lid slide pops off (magnetic). Hers is purple, mine is black, so we can keep them straight. These things are expensive, but in my view, worth every penny. Great product!",positive
254,Kitchen & Dining,"YETI Rambler 20 oz Tumbler, Stainless Steel, Vacuum Insulated with MagSlider Lid",$31.00 - $274.99,5,"Yeti does it again with another great mug that keeps your drink cold for hours or warm for hours. Ice lasts hours in the mug as well, which keeps drinks cold forever. The fact that its now spill proof only locks in the fact that this will forever be my go to company for mugs! I love this for coffee, soda, beer, and more. Great purchase for family and friends as well!",positive
255,Kitchen & Dining,"YETI Rambler 20 oz Tumbler, Stainless Steel, Vacuum Insulated with MagSlider Lid",$31.00 - $274.99,5,The NSRT made my Yeti Rambler a multi-use tumbler. I could use the tumbler for coffee early in the day and by removing the NRST use it for a cold beer later in the day without having to worry about cleaning or washing the tumbler. It kept my coffee piping hot and my beer icy cold. The insert makes my Yeti Rambler much more versatile and easier to clean.,positive
256,Kitchen & Dining,"YETI Rambler 20 oz Tumbler, Stainless Steel, Vacuum Insulated with MagSlider Lid",$31.00 - $274.99,5,"I’ve had this travel mug for several months now and I love how it keeps things cold. I haven’t tried to keep anything hot yet. I’m not big on drinking hot drinks.

It can leak a little if it is turned over or on its side. Just some drips, not a gusher like some. It’s also a bit big around. I have fairly large hands it is can be hard for me hold. Overall it is the best travel mug I’ve owned.",positive
257,Kitchen & Dining,"YETI Rambler 20 oz Tumbler, Stainless Steel, Vacuum Insulated with MagSlider Lid",$31.00 - $274.99,5,Love this bright yellow Yeti tumbler! Perfect 20 ounce size to hold as well as enough to drink. Dishwasher safe so I may need another one when it’s being cleaned.,positive
258,Kitchen & Dining,"YETI Rambler 20 oz Tumbler, Stainless Steel, Vacuum Insulated with MagSlider Lid",$31.00 - $274.99,5,Great size of tumbler for carrying drinks in the car. Leak proof and easy to hold along with easy to clean means this is one heck of a tumbler.,positive
259,Kitchen & Dining,"YETI Rambler 20 oz Tumbler, Stainless Steel, Vacuum Insulated with MagSlider Lid",$31.00 - $274.99,5,"Love all my Yeti products! This Rambler is a perfect size for me, fits well in my auto cup holder, has held ice for 24 hours and also keeps stuff hot all day. Highly recommend!",positive
260,Kitchen & Dining,"Hamilton Beach Personal Smoothie Blender With 14 Oz Travel Cup And Lid, Blue 51132",$21.84 - $54.98,4,"This is a side view. The lid looks like it is on & it did make a slight snapping sound but it is not on straight or tight. It takes a large bit of force to truly get it to snap on straight & tight. If you succeed in accomplishing that, when it’s time to take the top off you will find yourself yanking really hard to do so. If the cup is full & you try to drink it through the slide opening in the lid you “thought” you had secured, you will find the contents will begin to leak out of the side not completely snapped into place. That is when I just take the lid off (quite easily) & drink straight from the cup. If you have successfully snapped the lid down & have been able to pick up the cup & sip out of the lid while moving about or traveling, all is well. Once done drinking the contents & it is time to remove the secured lid be prepared to be over a sink & pull hard! It will eventually come off but any remaining liquid will likely splatter as it breaks free & pops open.
For the price, the blending performance is satisfactory. As for the travel cup concept, it is way too frustrating. You get what you pay for 😏",positive
261,Kitchen & Dining,"Hamilton Beach Personal Smoothie Blender With 14 Oz Travel Cup And Lid, Blue 51132",$21.84 - $54.98,4,"I bought this a year ago for like $13. It was the cheapest one available. It was a fun test to see what spending less would get. I used it for a year, with no problems.
Fact is, you have to respect a machine for what it is. Just like a car, or a watch or whatever.
You can't force them to be more than they are. If you know how to properly stack ingredients into a smoothie recipe and get the right proportions; you'll be fine. My tip. Blend with always half juice base. Poor into cup. Wash vessel immediately, and don't let fruit bits dry or fester, and you'll own this for a long time, no problems.
No Ice!
The problem I see with a lot of the complaints on Amazon reviews is people expecting these to grind ice.
There isn't one smoothie recipe I've even seen that calls for ice. Never use ice and you won't have problems!!",positive
262,Kitchen & Dining,"Hamilton Beach Personal Smoothie Blender With 14 Oz Travel Cup And Lid, Blue 51132",$21.84 - $54.98,5,"I looooove this thing! I have gastric issues and have to be very careful with what I eat. At this point people remember my dependable on protein shakes. I've got the shake bottles but my neighbor gave me one of these and It changed the game. Of course it's not perfect at blending frozen fruit but what do you expect from such an affordable and small appliance. I started blending everything in it! From coffee and creamer to make it foamy to shakes to my nightly banana shake and morning coffee and protein shake. I can even tailor what I blend for myself and put powder from empty capsules for sleep aid. I don't know what I'd to without it. Hers had some wear and tear and at one point I put the lid on one of the stove burners and it melted. I could have still used it just flipped the top but I wanted my own. I searched and this was the best price point and Hamilton is a great brand and bought my own, keeping the old one in case something happens I'll have back up parts but it's fantastic! I rarely write a review but this is a must have especially if you're the only one using it. A big blender would need more cleaning and this doubles as a cup to drink out of. I use it on average 3times a day and bought this one about 5 months ago and it's still holding up well! I'd buy it again. Heck if buy it for my friends. I'm soooooo happy with this purchase. I think it's time to throw out all those nasty shake gathering dust under my sink. So it's super easy to use has adequate blending power and I'd imagine anyone with physical restrictions finding those shake bottles difficult to use and maintain to use this! To clean usually I just run it under hot water for a little bit and bam ready for the next thing. Sooo easy to clean use and helps your health and we all could use a little boost because the path to being your best self begins within.",positive
263,Kitchen & Dining,"Hamilton Beach Personal Smoothie Blender With 14 Oz Travel Cup And Lid, Blue 51132",$21.84 - $54.98,4,"This blender is very powerful for the size. It does such a great job on ice. I was pleasantly surprised. My only issue was the lid. After not too long it began to split. (See picture) You can get replacement at Hamilton Beach for only $2.99; however shipping is a whopping $20+. I could buy a whole new blender for that. I did purchase 3 replacement lids because I would rather spend a few extra dollars to avoid throwing away a perfectly good blender and adding to the landfill, or cluttering up my cabinets with extra parts. But still, I think HB is gouging on the shipping.",positive
264,Kitchen & Dining,"Hamilton Beach Personal Smoothie Blender With 14 Oz Travel Cup And Lid, Blue 51132",$21.84 - $54.98,4,"Overall I enjoy this to make my smoothies in and can just lift off and take with me. One thing I would change would be how the lid it made. First, the lid is hard to lift off after being pushed down to 'lock on'. It would be nice if it screwed on instead. Then the slide on top that should cover the drink hole so it won't leak is not too great. It allows leaking and is too lightweight to really stop any liquids. Beside those issues, for the price, and color selections available, it is a very good choice.",positive
265,Kitchen & Dining,"Hamilton Beach Personal Smoothie Blender With 14 Oz Travel Cup And Lid, Blue 51132",$21.84 - $54.98,4,"This works great, the key is to always add your liquid to the blender first, otherwise the blades can get jammed up and you won't have a satisfactory blend. My only complaint about this blender is that no matter how many different ways I tried putting the lid on and keeping the mouthpiece closed I would get leaking out of the lid while blending which was pretty annoying and usually made a bit of a mess.",positive
