,cate,product,cost,review_star,review,tag
74,Kitchen & Dining,"BlenderBottle Classic V2 Shaker Bottle Perfect for Protein Shakes and Pre Workout, 20-Ounce, Cyan",$8.79 - $27.46,5,"So impressed with this bottle!
Doesn't leak, snaps tight, blends fast, cleans soooo easily, seems really sturdy and well made.
The stainless steel whisk ball is amazing, springy, and easy to clean. The smaller sized cups i got are PLENTY big enough for me, I'm not chugging gallon sized smoothies..lol. I just add like 8 or 10 oz liquid and 1 large scoop protein powder, shake for about 10 seconds and it's done! Easy to drink from without dripping. Every detail of these bottles is well thought out. The only improvement would be easier to read measurement markers on the side. I LOVE these shaker blender cups!",positive
75,Kitchen & Dining,"BlenderBottle Classic V2 Shaker Bottle Perfect for Protein Shakes and Pre Workout, 20-Ounce, Cyan",$8.79 - $27.46,5,"This is just a good, solid shaker bottle. The 28oz size is nice, the shaker ball does its job just fine, it's relatively inexpensive, and it doesn't leak. I can't complain. Go ahead and get yourself one of these.",positive
76,Kitchen & Dining,"BlenderBottle Classic V2 Shaker Bottle Perfect for Protein Shakes and Pre Workout, 20-Ounce, Cyan",$8.79 - $27.46,5,"Great blending bottle, leaves not trace of powder. Seems to pick up odor of milk pretty quickly though, need to at least rinse right away.",positive
77,Kitchen & Dining,"BlenderBottle Classic V2 Shaker Bottle Perfect for Protein Shakes and Pre Workout, 20-Ounce, Cyan",$8.79 - $27.46,5,This shaker bottle does everything that it’s supposed to do. Plus it comes in my favorite color (purple). I read some of the reviews before purchasing regarding the mouthpiece not closing. You just need to push down on it until you here a click.,positive
78,Kitchen & Dining,"BlenderBottle Classic V2 Shaker Bottle Perfect for Protein Shakes and Pre Workout, 20-Ounce, Cyan",$8.79 - $27.46,5,"I've had a Blender Bottle since they first came out in the 90's. Mixes up BodyBuilding Supplements, Pancake Batter, and even Metamucil!!! EVERY HOUSEHOLD SHOULD HAVE ONE!!! YOU WON'T BE DISAPPOINTED!!!",positive
79,Kitchen & Dining,"BlenderBottle Classic V2 Shaker Bottle Perfect for Protein Shakes and Pre Workout, 20-Ounce, Cyan",$8.79 - $27.46,5,"We use this all the time for our protein drinks. The round bottom helps to blend the mix with water. I will first blend water and mix (shake it up), add ice, and then blend again. Works great. Also, it's easy to clean.",positive
80,Kitchen & Dining,Bentgo Kids - Leakproof Children’s Lunch Box,$26.90 - $36.98,5,"If you're on the fence about which bento box to order for your child (BENTGO KIDS or YUMBOX), I will compare the two brands in this review. My family has used both kinds for about a month.

**BENTGO KIDS**

My 5 year-old kindergartner takes this box for his lunch, and it is truly the better choice for YOUNGER CHILDREN in my opinion. It has a more juvenile color scheme, five small food compartments, DURABLE RUBBER TRIM on the top and bottom, and overall exudes a higher quality product that will withstand more abuse than the Yumbox. The latches are more HEAVY-DUTY than the Yumbox, and although it can be a bit difficult for kids to close at first (it's a tight seal around the inner tray), my son got the hang of it after a couple tries. The Bentgo Kids trays come in three different colors and seem more durable than the Yumbox trays.

The Bentgo Kids box doesn't hold a LOT of food, but it is plenty for my son, and I imagine it will provide ample food until he's in second or third grade (probably a good box for 3-8 year-olds?). The largest compartment will fit a half sandwich unless your bread is huge, but then you can just cut it in quarters. The Bentgo Kids shell is a bit larger than the Yumbox, so it's a tight squeeze into my son's soft-sided LL Bean box, but we manage to fit the Bentgo and a Lifefactory water bottle into the LL Bean box.

*UPDATE* - We recently purchased an LL Bean Discovery lunch box, and this easily fits either the Bentgo or Yumbox as well as a water bottle and extras. The Bentgo also fits in a Lands' End ClassMate soft sided lunch box with a Goodbyn water bottle (see photo).

Does the Bentgo Kids leak? Nope. The rubber gasket on the lid is impressive, and ranch dressing has stayed neatly in the center dip compartment. The gasket on the Yumbox doesn't seem to be as good, so this is another reason why I like the Bentgo Kids better for younger children. It's pretty much foolproof. To clean, simply remove the inner tray and put it in the dishwasher. I always hand wash the outer shell or at least give it a wipe-down each day.

**YUMBOX PANINO**

I purchased this Yumbox Panino for my 9 year-old third grader. I like the Yumbox Panino colors and design better for OLDER CHILDREN (maybe 7-12 year-olds?). It's less juvenile than the Bentgo Kids box, and the Panino version has room for a larger sandwich. Since its tray has thin dividers, it will HOLD A BIT MORE FOOD too. The Yumbox has a slightly SMALLER FOOTPRINT than the Bentgo Kids, and it fits snugly in my son's LL Bean lunch box, but his water bottle does make his lunch box lid bulge out - not a big deal. We have since upgraded to the LL Bean Discovery lunch box, which is much deeper and has plenty of room. If you only have room for a small, narrow water bottle, the Goodbyn bottle is a great option (found on Amazon).

We have packed ranch dressing in the center, and as long as I press down tightly while latching the lid, it doesn't leak. The inner tray has printed text underneath (they are not removable stickers), but it does have a more grown-up look to it than the whimsical designs on other Yumbox trays. Yumbox sells plain trays on their website. The tray easily snaps out for washing in the dishwasher, but we always wash the outer shell by hand.

FOUR compartments or SIX? Yes, Yumbox offers two different versions - same size, but the trays have either more or less compartments. I debated greatly over which to buy, but ultimately I decided that the Panino (4 compartment) style would grown with my son better than the 6-compartment Yumbox, and on days when he doesn't pack a large sandwich, I simply use silicone baking cups as dividers. Links to the cupcake liners and leaf-shaped food picks shown in my photo are at the end of this review.

SUMMARY:

Both boxes have different features, so the box to choose really depends on your child's needs. The YUMBOX PANINO is my favorite for OLDER CHILREN or those who eat larger lunches because of the tray design and color combinations. The BENTGO KIDS is terrific for younger kids as it seems MORE DURABLE yet holds plenty of food for little ones. I do wish the Bentgo Kids box came in more colors, but perhaps this is in the works. For now, my son enjoys using his different-colored trays to switch things up a bit.

Links to other products shown in my photo:

Silicone Cupcake Liners (this set has red, which my sons had to have):
http://www.amazon.com/Silicone-Cupcake-Kitchen-Buddies-Included/dp/B00LR84HXA/ref=sr_1_1?s=kitchen&ie=UTF8&qid=1425867226&sr=1-1

Leaf Food Picks:
http://www.amazon.com/Tornado-P-2759-Leaf-pick-10P/dp/B0019XLGLE/ref=sr_1_1?s=home-garden&ie=UTF8&qid=1426438596&sr=1-1&keywords=leaf+food+picks

Goodbyn Bottle:
http://www.amazon.com/Goodbyn-20064BT-Bottle-Blue/dp/B0050O92PK/ref=sr_1_1?ie=UTF8&qid=1442187692&sr=8-1&keywords=goodbyn+bottle

February, 2017 UPDATE:
My second grader is still using his Bentgo Kids nearly every day, as it holds more than enough food for his appetite. The rubber trim began to peel off a bit on the outer container (though I always hand wash it), and Bentgo sent me a replacement! What a wonderful product and equally great customer service!",positive
81,Kitchen & Dining,Bentgo Kids - Leakproof Children’s Lunch Box,$26.90 - $36.98,5,"Great lunch box for toddlers, we use it everyday for school from ages 3 to 5. More environmentally friendly than using paper or plastic bags. No issue with leaks, and nothing has broken for us in over 2 years of use. Kids like it because the 5 compartments allows for more variety of foods to be packed. At our house we put ketchup in the middle circle compartment if needed for lunch, or a small sweet treat like a marshmallow (totally makes their day!). you can buy an extra tray with clear cover if it helps to make 2 lunches at once and save one for the next day. Customer service is great if you have questions. No long wait by phone or email. We are going to move up to the Fresh or Pop for our soon to be 6 year old.",positive
82,Kitchen & Dining,Bentgo Kids - Leakproof Children’s Lunch Box,$26.90 - $36.98,5,"We bought our first Bentgo box in 2018 and have used it several times a week for those 4 years and still love it. Bought our second box a couple years later, and it's the same great quality. No issues with leaking, compartments fit a lot of food, easy to clean, and little hands can easily open the box by themself. We often pack dinners on the go, and just hand the Bentgo insert to the kids for an easy carseat meal. Side tip: two Bentgo boxes fit perfectly in one PackIt Freezable Lunch Bag so you can keep two meals cold while out and about. They also have great customer service. Wouldn't have gone with any other kind!",positive
83,Kitchen & Dining,Bentgo Kids - Leakproof Children’s Lunch Box,$26.90 - $36.98,5,"Had two of these for a year and they’ve held up well. However, turns out I have the world’s pickiest eater for a kid, and these portion sizes and allotted areas pretty much limit our options. The tiny round section is pretty much useless and can hold raisins or candy. You cannot put anything moist or juicy in here without adding another bag or container bc it will leak into the other sections. You can only send cold food in this.",positive
84,Kitchen & Dining,Bentgo Kids - Leakproof Children’s Lunch Box,$26.90 - $36.98,5,"Even if you aren’t a crafty lunch maker! The variety alone with give options for a picky eater.
I bought this for my 2 year old and she loves it!
*It’s easy to open ( I practiced with her only serving her lunch at home in her lunchbox so she would be familiar prior to school starting).
*Portioned properly
*Easy to clean
*Leak Proof ( take your tim me inserting the plastic bumpers in grooves)
*Fits easily in toddler backpack",positive
85,Kitchen & Dining,Bentgo Kids - Leakproof Children’s Lunch Box,$26.90 - $36.98,5,Bought these lunchboxes December just notice mold I couldn’t take off I was getting ready to buy another one. My both boys love them makes it easy for me to pack every day for them Then realized it has 2 year warranty I emailed them I got quick response minutes after I sent them the pictures and info they needed. By end of day they had 2 in mail for me for replacements. Super easy quick no hassle and I didn’t have to pay for new ones! Super pleased.,positive
86,Kitchen & Dining,Bentgo Kids - Leakproof Children’s Lunch Box,$26.90 - $36.98,5,This school year my babies asked me to pack their lunches. I needed something reliable and found these online and I am in love!! The portion sizes are small but big enough to fill the kids up. There are 5 different sized compartments so I get to get creative with the snack choices. It’s super easy to clean and I don’t worry at all about leaking. It’s microwave and top shelf dishwasher safe. And the colors are so cute!! We plan on doing a video with these everyday to show what’s for lunch that day and I’ve already been asked so many times about them.,positive
87,Kitchen & Dining,Bentgo Kids - Leakproof Children’s Lunch Box,$26.90 - $36.98,5,"My 4 year old daughter LOVES her new lunchbox! She loves the color, being able to carry it without spilling, the compartments, everything. She even wants it for her meals at home!

For the parents, I could not believe how much it holds! In this pic, I fit the following:12 pieces of pepperoni, a cheese stick, 2 big mushrooms, 2.5 big florets of broccoli cut down into smaller pieces, 3 big strawberries, 6 raspberries, 6 cucumber slices, and a pack of fruit snacks. (Note: this is more than she usually eats in a sitting, but she likes to have lots of options). So far, it seems very sturdy, easy to clean and store, no leaking problems, the perfect size for her to carry (especially when we put it in a bag), and not too heavy. I'm very glad that we chose this lunchbox!",positive
88,Kitchen & Dining,Bentgo Kids - Leakproof Children’s Lunch Box,$26.90 - $36.98,5,I got this for my kindergartner. It was his favorite part about going to school!! I found he eats his food now that it’s in this. He even wants to eat out of it when he’s home or we travel. It’s completely leak proof and holds more than you’d think.,positive
89,Kitchen & Dining,Bentgo Kids - Leakproof Children’s Lunch Box,$26.90 - $36.98,5,"Bought one of these for my daughter, was a fan and got a second for my son. Cute, durable, little difficult for small ones to close properly so we practiced a little before he went to school with it but overall it is definitely leak proof if closed right and I have no complaints",positive
90,Kitchen & Dining,Bentgo Buddies Reusable Ice Pack - 4 Pack,$9.99,5,"I had the original square blue Bentgo freezer packs and loved them! Decided to order these because they match the colors of the Pottery Barn kids mackenzie space backpack and lunch box perfectly. These did not disappoint! Great lunchbox size, freeze well and stay frozen and easy to clean! High quality and highly recommend!",positive
91,Kitchen & Dining,Bentgo Buddies Reusable Ice Pack - 4 Pack,$9.99,5,I purchased the Bentgo Buddies Reusable Ice Packs for my grandson. They are a little larger than what I was I expecting but they are great. I got them to match his Bentgo Lunch Box and Bag plus it helps his lunch stay cool. If you purchased and kids lunch box go on and get the matching ice packs....they are awesome!!!,positive
92,Kitchen & Dining,Bentgo Buddies Reusable Ice Pack - 4 Pack,$9.99,5,They are still cool when my kids get home from school. They are very easy to clean. The size is perfect because if my kids want just a snack I can give them 1 ice pack and if they want me to pack them a lunch then I have no problem fitting 2 ice packs in their lunchbox. Plus my kids LOVE dinosaurs!,positive
93,Kitchen & Dining,Bentgo Buddies Reusable Ice Pack - 4 Pack,$9.99,5,"These are very durable and remain cold for a good period of time. They’re perfect for a child’s lunch. My son is starting Kindergarten this year, and he is happy to have a fun cold back in his lunch! The colors are bright and fun! 😀",positive
94,Kitchen & Dining,Bentgo Buddies Reusable Ice Pack - 4 Pack,$9.99,5,Two weeks of use and I can say these are worth it! So cute and perfect for my kid’s lunch box. They stay cold throughout the entire day!,positive
95,Kitchen & Dining,Bentgo Buddies Reusable Ice Pack - 4 Pack,$9.99,5,"They work great in my son's lunch box, they are thinner so they don't stay as cold as long but for school lunch time they work perfect!",positive
96,Kitchen & Dining,Bentgo Buddies Reusable Ice Pack - 4 Pack,$9.99,5,These fit in my daughters lunch bag perfectly. I put 1 on the top and 1 on the bottom of her lunch box and they always come home still cold ( 8 hours later) I’m very happy with my purchase.,positive
97,Kitchen & Dining,Bentgo Buddies Reusable Ice Pack - 4 Pack,$9.99,5,"These are such a good value!
This 4 pack was only $9.99!
My little girl loves the design and I love how thin they are.
They're not bulky/thick. They are a good size.
I would definitely recommend them!!",positive
98,Kitchen & Dining,Bentgo Buddies Reusable Ice Pack - 4 Pack,$9.99,5,Great product and keeps my daughter lunch cold! Easy to clean and quickly refreezes.,positive
99,Kitchen & Dining,Bentgo Buddies Reusable Ice Pack - 4 Pack,$9.99,5,"I use these i side my kids' lunch bags, under their bentgo boxes. They are slim enough to not make their bag heavier, yet help keep their food cool.",positive
100,Kitchen & Dining,"Bentgo All-in-one Stackable Lunch Box Solution-Sleek Modern Bento Box Includes 2 Stackable Containers, Built-in Plastic Silverware, Sealing Strap",$14.88 - $24.97,5,"I’ve been using Bentgo products for my kids’ lunches since 2018 and we’ve liked the quality and portion size as well as its stackable size everything fits well in the lunch bag and back packs.

I recently had my oldest Classic Bentgo lid crack on one edge and contacted Bentgo’s company customer service through email - they responded within a week and asked for proof of purchase (from 2018!) and photo of broken item. They are sending me a replacement at no extra charge! I’m very happy with how they’ve taken care of a customer and I will continue to support their business. I recommend them for the products and even more for their customer service.",positive
101,Kitchen & Dining,"Bentgo All-in-one Stackable Lunch Box Solution-Sleek Modern Bento Box Includes 2 Stackable Containers, Built-in Plastic Silverware, Sealing Strap",$14.88 - $24.97,4,I like that the portions compartments are perfect not to small nor big no wasting food. So far it hasn't leaked but I have not used it to store any liquidy foods. Also I like that you do not need to stack all 2 containers for when you want to take a small lunch also what I didn't like is that with out the utensil lid the containers will not seal properly but I guess that's the leak proof lid.,positive
102,Kitchen & Dining,"Bentgo All-in-one Stackable Lunch Box Solution-Sleek Modern Bento Box Includes 2 Stackable Containers, Built-in Plastic Silverware, Sealing Strap",$14.88 - $24.97,4,"I switched from the skinnier bento boxes to these and love them. But after using them for a couple of weeks there are some improvements that I think can be made.

1. I've noticed that over time the lids, for both parts, do not fit perfectly. This makes the bento box a little less secure and makes me worried about putting anything like fruit that might leak a little into the container.
2. The stretchy band gets dirty. After eating my lunch I always put the bento box back together and just throw it in my bag. When I got home I realized that there were stains from the food on the band. This isn't a huge deal but because the band has plastic on it, I don't want to wash it in the washing machine so I'd have to hand wash it somehow- just an extra hassle. Also, the band has become more stretchy over time so I'm afraid that my food isn't as secure as it was in the beginning when using it to close the containers.
3. The top box (with the two compartments) are not separated completely when closed. I put fruit on one side of the box and some chips on the other but when I opened it, my chips were soggy. I realized that the lid and edge in between the two compartments does not create a seal food as large as nuts can be shifted from one side to the other when closed.

Overall a good idea but just some improvements that I think would make this the perfect lunch box!",positive
103,Kitchen & Dining,"Bentgo All-in-one Stackable Lunch Box Solution-Sleek Modern Bento Box Includes 2 Stackable Containers, Built-in Plastic Silverware, Sealing Strap",$14.88 - $24.97,5,"I received this, lie all Amazon orders, promptly. The portion size is good, not too large, not overly cramped. I've been taking my lunch daily, salad in the bottom, protein and snack in the top. The utensils are serviceable. I wouldn't put anything in this that might leak (I put my dressing in a small disposable cup with lid) as I'm almost certain it will leak. Cleans really well. Small enough to carry or put in a briefcase/satchel/bag. I'm enjoying it and like the convenience.",positive
104,Kitchen & Dining,"Bentgo All-in-one Stackable Lunch Box Solution-Sleek Modern Bento Box Includes 2 Stackable Containers, Built-in Plastic Silverware, Sealing Strap",$14.88 - $24.97,4,"I bought these so my son could have something compact to take his lunch in.
I really like the concept and how everything is together. I don’t have to send a bunch of separate containers. One issue I have is the top split container doesn’t seal between the two sides. I had cantaloupe in one side and goldfish in the other to take on a zoo trip. We opened the top and the goldfish were soggy from the cantaloupe. So I guess nothing like that can go in the top and can only go by itself in the bottom which is inconvenient since a cut up sandwich fits great in the bottom.
I like it, but wish it was more leakproof.",positive
105,Kitchen & Dining,"Bentgo All-in-one Stackable Lunch Box Solution-Sleek Modern Bento Box Includes 2 Stackable Containers, Built-in Plastic Silverware, Sealing Strap",$14.88 - $24.97,5,"I bought this to have a space-efficient way to carry my lunches at work, and I was not disappointed! I knew it had to be about the size that it is because I use a Jansport Half Pint backpack for work (I don't need to carry much, usually just lunch, water, my phone and ID), and this Bentgo box fits perfectly. I was really surprised to have it fit so well next to my 32 oz. Hydroflask in the main compartment, so now I have a great way to take lunch to work. Thank goodness, because I was seriously nickel-and-dime-ing myself buying lunch in the employee lounge.

Literally the only complaint I have about this is that there is a little mixing in the top compartments if I don't pack it right, due to a gap between the center wall and the lid. Not a huge issue unless you *really* hate your grapes mixing with your peanut butter stuffed pretzels (for example); I just use a paper towel to keep one or the other from wandering across the compartments. Otherwise, I would recommend this container to anyone of any age who needs one.",positive
106,Kitchen & Dining,"Bentgo All-in-one Stackable Lunch Box Solution-Sleek Modern Bento Box Includes 2 Stackable Containers, Built-in Plastic Silverware, Sealing Strap",$14.88 - $24.97,5,Was exactly what I was looking for. I went through so many bento boxes and was never satisfied with them. Until I came across this beauty. Its compact. Has excellent portions and I can pack cold or hot meals. And even use my handy silicone cupcake liners to add extra sections down on the bottom. It's an excellent product. The negative reviews about kids not stays on is total lies it has a silicone the top lid to help with leaks and the strap helps even more. And very easy to clean. I clean by hand.,positive
107,Kitchen & Dining,"Bentgo All-in-one Stackable Lunch Box Solution-Sleek Modern Bento Box Includes 2 Stackable Containers, Built-in Plastic Silverware, Sealing Strap",$14.88 - $24.97,4,I was so excited for my bentgo containers I ordered two and it hasn't even been a week and the strap busted on one of them is there a way to order another strap? I love these little containers though!,positive
108,Kitchen & Dining,"Bentgo All-in-one Stackable Lunch Box Solution-Sleek Modern Bento Box Includes 2 Stackable Containers, Built-in Plastic Silverware, Sealing Strap",$14.88 - $24.97,5,"The whole reason why I bought this is that my sister recommended it to me when I was packing my lunch. Now when I first received this product, I loved it; I found the silverware compartment in handy. Before I got this, I would always forget to bring some. Now I don't have to worry about forgetting a fork or spoon. I liked how it all fit together; it was snug. Nothing really shifted much because of that reason. Although, after a couple of washes, the lid did not want to fit correctly, I was kind of nervous about using it because I thought the food would spill out. After this happened, I reached out to Bentgos Customer Support, and they got back to me quickly. They are currently sending me a replacement, the fastest customer service team. I usually wait days to hear back from other customer support teams. Overall very happy about my experience. I am planning on buying another one for my partner since he always just packs his stuff in ziplock bags. Also, I am planning on getting the salad bowl.",positive
109,Kitchen & Dining,"Bentgo All-in-one Stackable Lunch Box Solution-Sleek Modern Bento Box Includes 2 Stackable Containers, Built-in Plastic Silverware, Sealing Strap",$14.88 - $24.97,5,"Good product overall, not appropriate for liquids as the seal is not tight. The upper compartment divider does not go all the way up and small food will spill over the divider. Works very well for rice and stuff though. Happy with my purchase.",positive
110,Kitchen & Dining,"EasyLunchboxes - Bento Snack Boxes - Reusable 4-Compartment Food Containers for School, Work and Travel",$12.95 - $23.22,5,"I was looking for reusable containers to pack lunches and snacks for kids, especially those I could use to replace expensive, junk-heavy prepared snack items. With these, I can buy things in bulk, pre-pack snack boxes, and have grab-and-go quick and convenient options for the everyone. This particular size (4 compartment snack box) might be small for an older kid or adult for a whole meal, but they are perfect for recreating cracker/cheese/meat/nut/etc combo boxes. They are also considerably less expensive than the $3.00+ of similar items from the grocery store, and I can fill them with much higher quality ingredients. The boxes themselves are made of a sturdy plastic; they are not at all flimsy or cheap in quality. Unlike some other 'reusable' boxes I have tried, these actually are likely to be long lasting and reusable. Total win. Very happy.",positive
