,cate,product,cost,review_star,review,tag
177,Sports Collectibles,2022 Topps Series 2 Baseball Hobby Box (24 Packs/14 Cards 1 Silver Pack),$112.79,3,"Fast and compact shipping, but unfortunately when I opened the Silver Pack, it only had 3 cards. I was a little taken back by the fact that I didn't receive any numbered parallels either in the box.",fair
178,Sports Collectibles,(2 Packs) 2021/22 Upper Deck Series 1 NHL Hockey Fat Packs - 52 Cards - Collect Young Guns Rookie Cards,$13.95,2,Half of the cards had corners that were bent and coming apart as if they'd been handled alot already by kids.,negative
179,Sports Collectibles,2021 Prestige NFL Football Hanger Box 60 Cards. Exclusive Astral Parallel Cards,$26.99,5,This product is amazing! if you are a collecter i would buy,positive
180,Sports Collectibles,2021 Prestige NFL Football Hanger Box 60 Cards. Exclusive Astral Parallel Cards,$26.99,4,(Like new) like new my a**. Do Not buy. They rig the packs. They take all the cards that are worth money and leave the dog trash. What a waste of money.,positive
181,Sports Collectibles,2021 Prestige NFL Football Hanger Box 60 Cards. Exclusive Astral Parallel Cards,$26.99,5,Quality cards and you may get shorter prints.,positive
182,Sports Collectibles,2021 Prestige NFL Football Hanger Box 60 Cards. Exclusive Astral Parallel Cards,$26.99,4,The cards were pretty good and it came on time,positive
183,Sports Collectibles,2021 Prestige NFL Football Hanger Box 60 Cards. Exclusive Astral Parallel Cards,$26.99,5,"Perfect! Quick shipping, great product, great value!",positive
184,Sports Collectibles,2021 Prestige NFL Football Hanger Box 60 Cards. Exclusive Astral Parallel Cards,$26.99,5,My son loves these. It was a great gift,positive
185,Sports Collectibles,2021 Prestige NFL Football Hanger Box 60 Cards. Exclusive Astral Parallel Cards,$26.99,5,Birthday gift for grandson this is exactly what he wanted. He was so happy it was for his 12th birthday.,positive
186,Sports Collectibles,2021 Prestige NFL Football Hanger Box 60 Cards. Exclusive Astral Parallel Cards,$26.99,5,Got for my 9 year old son. All great cards of players he knew. Would buy this pack again!,positive
187,Sports Collectibles,2021 Prestige NFL Football Hanger Box 60 Cards. Exclusive Astral Parallel Cards,$26.99,3,Grandson disappointed there were no current football cards,fair
188,Sports Collectibles,2021 Prestige NFL Football Hanger Box 60 Cards. Exclusive Astral Parallel Cards,$26.99,5,It was delivered quickly and was perfect. I would order again.,positive
189,Sports Collectibles,DREAM LOT OF OLD UNOPENED BASKETBALL CARDS IN PACKS 60 Cards in Packs from the Late 80s and Early 90s,$19.95,4,Good to see older players I grew up watching.,positive
190,Sports Collectibles,DREAM LOT OF OLD UNOPENED BASKETBALL CARDS IN PACKS 60 Cards in Packs from the Late 80s and Early 90s,$19.95,5,These are in fact old basketball cars packs UNOPENED. Yea there are plenty of bad players. Was well worth it after we got a Jordan and a Bird. My son was ecstatic.,positive
191,Sports Collectibles,DREAM LOT OF OLD UNOPENED BASKETBALL CARDS IN PACKS 60 Cards in Packs from the Late 80s and Early 90s,$19.95,2,My 9 yr old was really disappointed. There was no variety at all. All 4 packs were 90-91. He saved up for weeks to get this.,negative
192,Sports Collectibles,DREAM LOT OF OLD UNOPENED BASKETBALL CARDS IN PACKS 60 Cards in Packs from the Late 80s and Early 90s,$19.95,5,fast delivery and great prices and items as described,positive
193,Sports Collectibles,DREAM LOT OF OLD UNOPENED BASKETBALL CARDS IN PACKS 60 Cards in Packs from the Late 80s and Early 90s,$19.95,4,Got 4 skybox packs it was decent!!,positive
194,Sports Collectibles,DREAM LOT OF OLD UNOPENED BASKETBALL CARDS IN PACKS 60 Cards in Packs from the Late 80s and Early 90s,$19.95,4,Not great value in the cards..,positive
195,Sports Collectibles,DREAM LOT OF OLD UNOPENED BASKETBALL CARDS IN PACKS 60 Cards in Packs from the Late 80s and Early 90s,$19.95,1,I have never in my life written a complaint or review but this deserves one. I am into this shim sham for well over $160 and I am livid. I bought 3 orders and they were mostly duplicates. I waited a week and bought another 3 orders and two of the packs were IDENTICAL with garbage players. I literally have 4 cards of the same player multiple times. This was for me and my son to enjoy and you took advantage.,negative
196,Sports Collectibles,DREAM LOT OF OLD UNOPENED BASKETBALL CARDS IN PACKS 60 Cards in Packs from the Late 80s and Early 90s,$19.95,3,No hall of fame cards,fair
197,Sports Collectibles,DREAM LOT OF OLD UNOPENED BASKETBALL CARDS IN PACKS 60 Cards in Packs from the Late 80s and Early 90s,$19.95,2,4 packs of cards for 20 dollars you could buy for 2-3 dollars each. not good value,negative
198,Sports Collectibles,DREAM LOT OF OLD UNOPENED BASKETBALL CARDS IN PACKS 60 Cards in Packs from the Late 80s and Early 90s,$19.95,3,A lot of common cards,fair
199,Sports Collectibles,2021 Panini Prizm NFL Football MEGA box (40 cards/bx incl. ONE Memorabilia or Autograph card),$142.50,2,Opened box got nothing,negative
200,Sports Collectibles,Topps 2021 Baseball Factory Sealed Complete Retail Box (660 Cards 5 Rookie Variations),$64.23,5,"La puntualidad de la entrega según señalada, da seguridad al momento de hacer las compras.
Enseñar a mi nieto a coleccionar tarjetas de peloteros es mi deleite ahora.",positive
201,Sports Collectibles,Topps 2021 Baseball Factory Sealed Complete Retail Box (660 Cards 5 Rookie Variations),$64.23,5,Great add to my guys collection. He likes to have a box every year.,positive
202,Sports Collectibles,Topps 2021 Baseball Factory Sealed Complete Retail Box (660 Cards 5 Rookie Variations),$64.23,5,Lo recibí bien empacado y protegido; mucha nostalgia al ver cada tarjeta.,positive
203,Sports Collectibles,Topps 2021 Baseball Factory Sealed Complete Retail Box (660 Cards 5 Rookie Variations),$64.23,5,I've been collecting these complete sets for over 38 years!,positive
204,Sports Collectibles,Topps 2021 Baseball Factory Sealed Complete Retail Box (660 Cards 5 Rookie Variations),$64.23,5,"I received the baseball cards earlier than expected. They arrived in perfect condition. I was so pleased with my purchase.
My grandson was so excited when he opened them at Christmas.",positive
205,Sports Collectibles,Topps 2021 Baseball Factory Sealed Complete Retail Box (660 Cards 5 Rookie Variations),$64.23,5,Cards arrived neatly packaged and in excellent condition.Shipping accurate and prompt.,positive
206,Sports Collectibles,Topps 2021 Baseball Factory Sealed Complete Retail Box (660 Cards 5 Rookie Variations),$64.23,5,Exactly what I was looking for and the shipping was quick. Highly recommend these folks.,positive
207,Sports Collectibles,Topps 2021 Baseball Factory Sealed Complete Retail Box (660 Cards 5 Rookie Variations),$64.23,5,"If you're a baseball card collector, there can be no better gift than the complete set (including rookie cards) from the original baseball card company.",positive
208,Sports Collectibles,Topps 2021 Baseball Factory Sealed Complete Retail Box (660 Cards 5 Rookie Variations),$64.23,5,This is a gift,positive
209,Sports Collectibles,Topps 2021 Baseball Factory Sealed Complete Retail Box (660 Cards 5 Rookie Variations),$64.23,5,A must buy for all collectors. Thank you,positive
210,Sports Collectibles,NEW 2021-22 Panini NBA HOOPS Factory Sealed Basketball Box w/88 Cards (Look for Autograph or Memorabilia Cards) - Look for Popular SLAM Inserts - Plus Custom Made Luka and Lebron Basketball Card Pictured.,$59.99,4,My nephew was pleased with the pack. Exactly as advertised.,positive
211,Sports Collectibles,NEW 2021-22 Panini NBA HOOPS Factory Sealed Basketball Box w/88 Cards (Look for Autograph or Memorabilia Cards) - Look for Popular SLAM Inserts - Plus Custom Made Luka and Lebron Basketball Card Pictured.,$59.99,5,The Box held many of the desirable Rookie Cards,positive
212,Sports Collectibles,NEW 2021-22 Panini NBA HOOPS Factory Sealed Basketball Box w/88 Cards (Look for Autograph or Memorabilia Cards) - Look for Popular SLAM Inserts - Plus Custom Made Luka and Lebron Basketball Card Pictured.,$59.99,5,Ok so I obviously enjoyed it but like they took way way too long to ship much longer then the delivered by date. It was only a couple more however,positive
213,Sports Collectibles,NEW 2021-22 Panini NBA HOOPS Factory Sealed Basketball Box w/88 Cards (Look for Autograph or Memorabilia Cards) - Look for Popular SLAM Inserts - Plus Custom Made Luka and Lebron Basketball Card Pictured.,$59.99,5,Met Expectations and then some because it was in pristine condition and I didn't realize the extra cards that came with it.,positive
214,Sports Collectibles,NEW 2021-22 Panini NBA HOOPS Factory Sealed Basketball Box w/88 Cards (Look for Autograph or Memorabilia Cards) - Look for Popular SLAM Inserts - Plus Custom Made Luka and Lebron Basketball Card Pictured.,$59.99,1,You have a photo of a box that is not a Hobby Box. How can you say in your description that there is a guaranteed 1 autograph card? Elaborate please…,negative
215,Sports Collectibles,NEW 2021-22 Panini NBA HOOPS Factory Sealed Basketball Box w/88 Cards (Look for Autograph or Memorabilia Cards) - Look for Popular SLAM Inserts - Plus Custom Made Luka and Lebron Basketball Card Pictured.,$59.99,5,nice box of cards,positive
216,Sports Collectibles,2021 Donruss Optic Football Blaster Box Factory Sealed 6 Packs per Box 4 Cards Per Pack,$69.99,4,Got more hits than prizm,positive
