,cate,product,cost,review_star,review,tag
0,Sports Collectibles,"Panini FIFA World Cup QATAR 2022 ALBUM + BOX (50 Packs, 5 Stickers per pack)",$62.00,5,Its the best one out yet,positive
1,Sports Collectibles,"Panini FIFA World Cup QATAR 2022 ALBUM + BOX (50 Packs, 5 Stickers per pack)",$62.00,1,To much money for some stickers that going be on the trash sooner,negative
2,Sports Collectibles,PANINI FIFA WORLD CUP QATAR 2022 STICKER BOX (50 packs x 5 stickers),$60.00,4,"Description says album + sticker box, I only recieved the stickers, but not the albums ….",positive
3,Sports Collectibles,PANINI FIFA WORLD CUP QATAR 2022 STICKER BOX (50 packs x 5 stickers),$60.00,3,This one does not bring the album just the stickers. Cheaper than panini…. 🤔,fair
4,Sports Collectibles,PANINI FIFA WORLD CUP QATAR 2022 STICKER BOX (50 packs x 5 stickers),$60.00,5,"Play Video
 50 packs with 5 players each, I thought it was a scam and I was scared of buying not gonna lie, but I buy and I got my thing!! I got MESSI AND LEWANDOWSKI 😭😭",positive
5,Sports Collectibles,PANINI FIFA WORLD CUP QATAR 2022 STICKER BOX (50 packs x 5 stickers),$60.00,1,Missing tbe album. On the original description it included the album. However I didnt received the album.,negative
6,Sports Collectibles,PANINI FIFA WORLD CUP QATAR 2022 STICKER BOX (50 packs x 5 stickers),$60.00,1,The box was broken when I received it,negative
7,Sports Collectibles,2022 Topps Series 1 Baseball Trading Cards Blaster Box (99 cards per box),$28.25,5,The box of 99 baseball cards arrived promptly as promised and my 11 year old grandson was really excited and happy with this birthday gift. I'm not a big baseball fan so I can only judge by the smile on his face that this was a welcome gift. It was shipped to my mailbox promptly as promised and in excellent condition.,positive
8,Sports Collectibles,2022 Topps Series 1 Baseball Trading Cards Blaster Box (99 cards per box),$28.25,5,Pulled a wander Franco refractor rookie,positive
9,Sports Collectibles,2022 Topps Series 1 Baseball Trading Cards Blaster Box (99 cards per box),$28.25,5,Product came on time. My grandson was thrilled with the cards he got.,positive
10,Sports Collectibles,2022 Topps Series 1 Baseball Trading Cards Blaster Box (99 cards per box),$28.25,5,Fast shipping; sturdy packaging; came as advertised,positive
11,Sports Collectibles,2022 Topps Series 1 Baseball Trading Cards Blaster Box (99 cards per box),$28.25,4,"Although I didn't get any hits, that's the chance you take. I had no problems with the product or dealer... the delivery is a different story.",positive
12,Sports Collectibles,2022 Topps Series 1 Baseball Trading Cards Blaster Box (99 cards per box),$28.25,5,2022 hanger boxes aren’t really going to get you your money back. But good gifts to kids.,positive
13,Sports Collectibles,2022 Topps Series 1 Baseball Trading Cards Blaster Box (99 cards per box),$28.25,5,Great cards to collects or sell them!!,positive
14,Sports Collectibles,2022 Topps Series 1 Baseball Trading Cards Blaster Box (99 cards per box),$28.25,5,I feel like it was a great but for a gift,positive
15,Sports Collectibles,2022 Topps Series 1 Baseball Trading Cards Blaster Box (99 cards per box),$28.25,5,Our grandson was thrilled,positive
16,Sports Collectibles,2022 Topps Series 1 Baseball Trading Cards Blaster Box (99 cards per box),$28.25,5,"Appeared sealed from factory, cards were in mint condition and was good value for the money. As far as I can tell you got the most cards for your money vs other sellers I considered.",positive
17,Sports Collectibles,100 Vintage Baseball Cards in Old Sealed Wax Packs - Perfect for New Collectors,$13.95,5,Easy Order / Fast Delivery /,positive
18,Sports Collectibles,100 Vintage Baseball Cards in Old Sealed Wax Packs - Perfect for New Collectors,$13.95,5,Good names,positive
19,Sports Collectibles,100 Vintage Baseball Cards in Old Sealed Wax Packs - Perfect for New Collectors,$13.95,5,"Not only was is fun opening the same packs of baseball cards I used to when I was a kid but I also got a 1990 Bowman Frank Thomas Rookie card in one of the unopened packs. All the packs where still factory sealed and i not only got that Frank Thomas rookie card but I also got several other stars and hall of famers as well.. Cal Ripken jr, Don Mattingly, Jose Canseco, Rafael Palmerio, Nolan Ryan, Will Clark, Carlton Fisk, Dale Murphy, Joe Carter, Jim Abbott, Mike Greenwell.. To name a few.. Over all an amazing buy even if i didn't get the Frank Thomas rookie i'd still be happy with my purchase...",positive
20,Sports Collectibles,100 Vintage Baseball Cards in Old Sealed Wax Packs - Perfect for New Collectors,$13.95,4,I got a few good names. Then a Sammy Sosa Star Rookie Card showed up I would post an image but I feel less handling is better for value.,positive
21,Sports Collectibles,100 Vintage Baseball Cards in Old Sealed Wax Packs - Perfect for New Collectors,$13.95,5,It was a gift for my grandson and he loved it,positive
22,Sports Collectibles,100 Vintage Baseball Cards in Old Sealed Wax Packs - Perfect for New Collectors,$13.95,3,Just like I remembered,fair
23,Sports Collectibles,100 Vintage Baseball Cards in Old Sealed Wax Packs - Perfect for New Collectors,$13.95,2,"So This is not expensive so you get what you pay for. I was looking for a bit of fun for my child. The packs we got were some of the old generic clear three packs then a freer and some other wax package. One pack was obviously opened before. This was bought to be a little treasure hunt. I do not buy scratch off tickets that are already scratched off. Likewise, I prefer card packs to be unopened. So my guess is that one will not have any treasure. So I am feeling a little meh about it. Just send 5 wax sealed packs and I think I would be happy. Other reviews said the same thing so I cannot be too disappointed.",negative
24,Sports Collectibles,100 Vintage Baseball Cards in Old Sealed Wax Packs - Perfect for New Collectors,$13.95,3,They where what they advertised,fair
25,Sports Collectibles,100 Vintage Baseball Cards in Old Sealed Wax Packs - Perfect for New Collectors,$13.95,4,"Not sure that when someone writes NO good cards, they open them and take out the good ones is actually true. I am guessing they are either a competitor wanted to write bad reviews or what, but I bought 2 sets of these for my son and 26 dollars spent, we got some pretty good cards.
Mike Mussina Rookie $45
Mike Boddick Rookie $25
Ken Griffey Jr $80
and about 15 other cards that are now is protective sleeves for future worth all averaging around 15 dollar a piece. So either I got packs by mistakes or some reviews cant be trusted.

Will buy again.",positive
26,Sports Collectibles,100 Vintage Baseball Cards in Old Sealed Wax Packs - Perfect for New Collectors,$13.95,5,"As always , great cards from a great seller & for an amazing price too",positive
27,Sports Collectibles,2022 Topps Series 1 Baseball Trading Cards Hanger Box (67 Cards),$18.90,5,The Topps Baseball Cards make a great addition to my grandson's collection. He is 10 years old and loves to get baseball cards.,positive
28,Sports Collectibles,2022 Topps Series 1 Baseball Trading Cards Hanger Box (67 Cards),$18.90,1,Both boxes arrived damaged. Cards not in original factory sealed packaging. Pretty certain these have been presorted cards. Shameful!,negative
29,Sports Collectibles,2022 Topps Series 1 Baseball Trading Cards Hanger Box (67 Cards),$18.90,1,Thanks,negative
30,Sports Collectibles,2022 Topps Series 1 Baseball Trading Cards Hanger Box (67 Cards),$18.90,5,New season exciting time.,positive
31,Sports Collectibles,2022 Topps Series 1 Baseball Trading Cards Hanger Box (67 Cards),$18.90,5,I have been collecting Topps cards from the late 70's.,positive
32,Sports Collectibles,2022 Topps Series 1 Baseball Trading Cards Hanger Box (67 Cards),$18.90,5,What a great deal. All our boxes were primo,positive
33,Sports Collectibles,2022 Topps Series 1 Baseball Trading Cards Hanger Box (67 Cards),$18.90,3,Disappointed in 4 boxes I've purchased hoping for at least 1 autograph but no.,fair
34,Sports Collectibles,2022 Topps Series 1 Baseball Trading Cards Hanger Box (67 Cards),$18.90,,"2021を購入したときは数枚毎　きちんとパッケージの袋に入っていましたが、この2022は67枚全てがもう一まとめ、透明袋に入っています。
やはり その思惑通り 大谷くんのカードは1枚も入っていませんでした。出品者の詐欺じゃないでしょうか。",fair
35,Sports Collectibles,100 Vintage Football Cards in Old Sealed Wax Packs - Perfect for New Collectors,$16.95,4,"I collect Baseball cards and decided to get into football cards as well. I got 2 bundles and I am happy with what I got. Only one double card. I also got A Joe Montana, Dan Marino, Icky Woods, Boomer Esiason, Howie Long, Don Shula and Chuck Knolls Coaches cards. I am pretty happy with what I got. A good start for a casual collector.",positive
36,Sports Collectibles,100 Vintage Football Cards in Old Sealed Wax Packs - Perfect for New Collectors,$16.95,5,This was so much fun. Pulled several Joe Montana cards and some Bo Jackson! Def will buy again. Cards were in amazing shape.,positive
37,Sports Collectibles,100 Vintage Football Cards in Old Sealed Wax Packs - Perfect for New Collectors,$16.95,5,"The package arrived early, the packs looked to be in mint condition and the cards were all what I'd consider pack fresh. The value is tremendous considering some of the cards I got. I had a very fun time opening them and I pulled two Joe Montana cards and an Emmit Smith card and all were in mint condition. Very happy with my purchase and I already ordered some more.",positive
38,Sports Collectibles,100 Vintage Football Cards in Old Sealed Wax Packs - Perfect for New Collectors,$16.95,5,This was awesome made me remember all the cards that I've had before. I love this alot and I can't wait to get them graded,positive
39,Sports Collectibles,100 Vintage Football Cards in Old Sealed Wax Packs - Perfect for New Collectors,$16.95,4,"Overall it was a fun rip for the value. My daughter enjoyed going through them. The only thing that I was a little disappointed with was that I ordered 2 and both bags had the same exact packs, so it didn't seem that random.",positive
40,Sports Collectibles,100 Vintage Football Cards in Old Sealed Wax Packs - Perfect for New Collectors,$16.95,5,Xmas gift I know he's gonna love it,positive
41,Sports Collectibles,100 Vintage Football Cards in Old Sealed Wax Packs - Perfect for New Collectors,$16.95,4,Good variety,positive
42,Sports Collectibles,100 Vintage Football Cards in Old Sealed Wax Packs - Perfect for New Collectors,$16.95,5,on time and awesome packs,positive
43,Sports Collectibles,100 Vintage Football Cards in Old Sealed Wax Packs - Perfect for New Collectors,$16.95,4,Bought for my partner who is an avid collector. She said it came with a good variety of cards. They were also all in good shape. Good value for the price.,positive
44,Sports Collectibles,100 Vintage Football Cards in Old Sealed Wax Packs - Perfect for New Collectors,$16.95,5,was fun ripping 32 year old unopened packs pulled a Bo Jackson too,positive
45,Sports Collectibles,2022 Topps Series 2 Relic Box - 7 Packs Per Box,$26.99,4,Good price and fast delivery,positive
46,Sports Collectibles,2022 Topps Baseball Series 2 Hanger Pack,$18.90,4,The only thing I recommend is hiding them from your girlfriend.,positive
47,Sports Collectibles,2022 Topps Baseball Series 2 Hanger Pack,$18.90,1,Product comes used !,negative
48,Sports Collectibles,2021 Panini Prizm NFL Football BLASTER Box (6 pks/bx),$58.99,5,Very carefully packed. Arrived in excellent condition. Exactly what I ordered.,positive
49,Sports Collectibles,2021 Panini Prizm NFL Football BLASTER Box (6 pks/bx),$58.99,5,All good,positive
50,Sports Collectibles,2021 Panini Prizm NFL Football BLASTER Box (6 pks/bx),$58.99,5,Nice cards,positive
51,Sports Collectibles,2022 Topps Gypsy Queen Baseball Value Box,$28.95,5,Arrived on time and I perfect condition. Love the look of these cards and was fortunate enough to pull a Gavin Sheets Rookie Auto! Solid box for a good price.,positive
52,Sports Collectibles,2022 Topps Gypsy Queen Baseball Value Box,$28.95,4,My grandson was happy with product,positive
53,Sports Collectibles,2022 Topps Gypsy Queen Baseball Value Box,$28.95,4,"Cards were great. Had couple really good cards. The cards themselves had a slight messed up print, but was not at all the sellers fault. Would definitely buy from seller again. Had a great time opening packs up!",positive
54,Sports Collectibles,2022 Topps Gypsy Queen Baseball Value Box,$28.95,5,"Great cards, great condition, came in earlier than I thought it’d come in! I pulled wander Franco rookie and an autograph. Didn’t seem resealed. Great purchase.",positive
55,Sports Collectibles,2022 Topps Gypsy Queen Baseball Value Box,$28.95,5,"Quick shipping, great packaging to prevent any damage! Will buy again for sure!",positive
56,Sports Collectibles,2022 Topps Gypsy Queen Baseball Value Box,$28.95,5,Fair price and fast shipping. Can't ask for more.,positive
57,Sports Collectibles,2022 Topps Gypsy Queen Baseball Value Box,$28.95,4,"Got a Brady Singer auto with missing nameplate, plus another missing nameplate card, and a green Tatis parallel. That's about as good of a retail box you can expect

Only issue was for two packs the cards were pretty warped, looked like from factory. The warped cards are not a bent, will be ok under a book for a few days. Lol",positive
58,Sports Collectibles,2022 Topps Gypsy Queen Baseball Value Box,$28.95,5,"One of my favorite sets that’s not as expensive. Pulled nice parallels and numbered cards and an auto that I’m sending in to get graded. When u buy these boxes u have odds on the side of your chances. Know that before u buy and leave bad feedback cause u didn’t pull a banger. It’s priced right.. great product, will be getting another box. Just make sure u don’t buy from Worldpeace!! They ripped me off on a bowman blaster.",positive
59,Sports Collectibles,2022 Topps Gypsy Queen Baseball Value Box,$28.95,1,Bought 4 boxes of this junk. Cards are bland. All look the same. Parallels are mundane. Save your money for Topps Chrome or Stadium Club.,negative
60,Sports Collectibles,2022 Topps Gypsy Queen Baseball Value Box,$28.95,1,Not worth it. Will return,negative
61,Sports Collectibles,"600 Baseball Cards Including Babe Ruth, Unopened Packs, Many Stars, and Hall-of-famers. Ships in Brand New White Box Perfect for Gift Giving. Includes At Least One Original Unopened Pack of Topps Vintage Baseball Cards That Is At Least 25 Years Old!",$21.94,4,"I spent an Amazon gift card and bought this along with a couple 2022 wax boxes out of morbid curiosity since I see this on sale all of the time. I recently started collecting again and enjoying buying large lots from goodwill and the hunt of looking for cards so I though it would be interesting to compare.

The cards were in great condition and packaged well. The result, mostly junk wax era. The Babe Ruth card is from a 1992 set and worth about a quarter. There were ten 80's and 90's star cards worth between 25 cents and 2 dollars packaged in plastic with the Ruth card. The one pack was 94 stadium club and I got a decent Frank Thomas insert card. The 600 cards were junk wax including 90 leaf, 90 fleer, 92 donruss and 91 topps. Mostly commons, Many repeats, but a few star players including a 91 topps Chipper Jones rookie. There were about 100 minor league cards which didnt yield much and strangely about 150 Julio Franco cards ranging from 86-94. I have yet to look through those, but there seem to at least be some inserts.

The four star rating is five stars for packaging and condition but three stars for cards. Ive seen much better but also seen much worse. My guess is that there is some variance in value, and what myself and others got is due to the luck of the draw. You will likely get your moneys worth for 25 dollars but don't expect to find a hidden gem or turn a profit.",positive
62,Sports Collectibles,"600 Baseball Cards Including Babe Ruth, Unopened Packs, Many Stars, and Hall-of-famers. Ships in Brand New White Box Perfect for Gift Giving. Includes At Least One Original Unopened Pack of Topps Vintage Baseball Cards That Is At Least 25 Years Old!",$21.94,5,It was every penny nothing I dislike I will be buying more I don't understand why people are crying about what they got not everything is perfect I believe the seller has try too correct and apply better services too value his costermers Im gratefully happy and could not ask for better think you America's Sports Card for your product and helping me enjoy my new collection Good Day Brother,positive
63,Sports Collectibles,"600 Baseball Cards Including Babe Ruth, Unopened Packs, Many Stars, and Hall-of-famers. Ships in Brand New White Box Perfect for Gift Giving. Includes At Least One Original Unopened Pack of Topps Vintage Baseball Cards That Is At Least 25 Years Old!",$21.94,4,,positive
64,Sports Collectibles,"600 Baseball Cards Including Babe Ruth, Unopened Packs, Many Stars, and Hall-of-famers. Ships in Brand New White Box Perfect for Gift Giving. Includes At Least One Original Unopened Pack of Topps Vintage Baseball Cards That Is At Least 25 Years Old!",$21.94,5,"My son received this, cause he's into baseball. He loves it.. What a great gift to give to a baseball player or a person that likes baseball...",positive
65,Sports Collectibles,"600 Baseball Cards Including Babe Ruth, Unopened Packs, Many Stars, and Hall-of-famers. Ships in Brand New White Box Perfect for Gift Giving. Includes At Least One Original Unopened Pack of Topps Vintage Baseball Cards That Is At Least 25 Years Old!",$21.94,4,It was just as described. 600 cards. I didn’t really get any good cards in the the 600. But that is the luck of the draw,positive
66,Sports Collectibles,"600 Baseball Cards Including Babe Ruth, Unopened Packs, Many Stars, and Hall-of-famers. Ships in Brand New White Box Perfect for Gift Giving. Includes At Least One Original Unopened Pack of Topps Vintage Baseball Cards That Is At Least 25 Years Old!",$21.94,5,It had some good stars and few doubles and triples but I really enjoyed the assortment.,positive
67,Sports Collectibles,"600 Baseball Cards Including Babe Ruth, Unopened Packs, Many Stars, and Hall-of-famers. Ships in Brand New White Box Perfect for Gift Giving. Includes At Least One Original Unopened Pack of Topps Vintage Baseball Cards That Is At Least 25 Years Old!",$21.94,3,"Was expecting some tradable or possible great card. These are kind of ""run of the mill"" cards.",fair
68,Sports Collectibles,"600 Baseball Cards Including Babe Ruth, Unopened Packs, Many Stars, and Hall-of-famers. Ships in Brand New White Box Perfect for Gift Giving. Includes At Least One Original Unopened Pack of Topps Vintage Baseball Cards That Is At Least 25 Years Old!",$21.94,5,Great for gift giving and prep-school for future collectors.,positive
69,Sports Collectibles,"600 Baseball Cards Including Babe Ruth, Unopened Packs, Many Stars, and Hall-of-famers. Ships in Brand New White Box Perfect for Gift Giving. Includes At Least One Original Unopened Pack of Topps Vintage Baseball Cards That Is At Least 25 Years Old!",$21.94,5,The baseball cards came in very good condition and the experience of childhood was re-lived as I perused the many cards.,positive
70,Sports Collectibles,"600 Baseball Cards Including Babe Ruth, Unopened Packs, Many Stars, and Hall-of-famers. Ships in Brand New White Box Perfect for Gift Giving. Includes At Least One Original Unopened Pack of Topps Vintage Baseball Cards That Is At Least 25 Years Old!",$21.94,3,Great set for beginners. Only 3 inserts not worth more then 50 cents and the Babe Ruth card is a reprint.,fair
71,Sports Collectibles,Baseball Card Collector Box With Over 500 Cards,$19.95,5,"As advertised with cards from many different years. My son really likes them. I haven’t found too many big stars but for a kid they are great. Got cards from the 50s, 60s, and 70s along with others.",positive
72,Sports Collectibles,Baseball Card Collector Box With Over 500 Cards,$19.95,5,"I was very impressed with the selection and condition of this 500 card set of cards. Set included many Hall of Fame members such as Nolan Ryan, Reggie Jackson, Alan Trammell, and many more. Every card in the set was vintage (at least 20 years old). I also liked the variety of cards in the set, for example different years and different brands such as Upper Deck, Topps, Donruss and lots of rookies. All collector's love rookies. This set had a lot of them. I will definitely purchase more cards from this Seller. On a scale of 1 to 10, 10 being the highest I would rate this set at 9.5 to 10.",positive
73,Sports Collectibles,Baseball Card Collector Box With Over 500 Cards,$19.95,3,"I in past was displeased with a Kruks Cards box, so I scrolled through other optional sellers. Superior Sports Investments offer better variety of brands and years. However wasn't as described, no vintage as promised. Few HOFers. So So cards. All your ten cent cards here.",fair
74,Sports Collectibles,Baseball Card Collector Box With Over 500 Cards,$19.95,5,Both my children liked these cards and really appreciated them.,positive
75,Sports Collectibles,Baseball Card Collector Box With Over 500 Cards,$19.95,4,"This is a really good value. The cards have always been in great condition. There’s always been the over produced wax packs, but there’s also been cards I’ve not seen a lot of before. Two Nolan Ryan cards also sit on top of the set, which is my favorite part.
All that to say, The first time I bought this, I was like a kid in a candy store. Opened it up and there were a bunch of HOF’s, a bunch of cards from the two teams I collect, and a good diverse selection of cards from many different years. However, the past two I’ve ordered have been much more watered down. Only had 4-5 HOF’s in these last two boxes each (there are 500 cards). Less than 10 of the two teams I collect (not huge market teams), and A LOT of doubles and triples of players. I even had four of the same guy consecutively.
My point is that where it seemed as though before they were just taking a chunk out of a set or from a pack, now It seems as though they’ve been sorted through and the company is purposely holding back the fun/valuable cards.
It is still fun to open and have 500 cards and for the price it is great for building a collection. But, if you are looking to score some HOF’s, your favorite players or teams, you might just be better off buying old packs.",positive
76,Sports Collectibles,Baseball Card Collector Box With Over 500 Cards,$19.95,4,Way to many doubles almost 100 like Morgan cards,positive
77,Sports Collectibles,Baseball Card Collector Box With Over 500 Cards,$19.95,3,"Did have older cards as ad says, majority of cards from 80s the rest were 90s very few from early 2000. The 50,60,70 were poor grade.",fair
78,Sports Collectibles,Baseball Card Collector Box With Over 500 Cards,$19.95,2,"Received my box of 500 baseball cards. Was surprised to see that they were all from the 1980s. Thought there would at least be some from each decade through at least 2010.

My 19 year old son only recognized those of players who are now Managers (Francona, Black, Molitor) or MLB Commentators (Lieter, Darling, Reynolds)

Must say I was disappointed overall.",negative
79,Sports Collectibles,Baseball Card Collector Box With Over 500 Cards,$19.95,5,I recommend this greatly for any collector. The cards came well organized in a sturdy box. Thanks for the great amount of care and attention you put in these.,positive
80,Sports Collectibles,Baseball Card Collector Box With Over 500 Cards,$19.95,3,"This was the 2nd time I have ordered this box. Now the 1st time there was no option to write a review. Despite not recieving the 1 card from the 1950s or 2 from the 1960s as promised in the description and one of the main reasons I purchased this item, the 1st box had a decent amount of rookies and inserts including numbered cards. Although disapointed from no vintage cards the inserts and rookies I did gain, which were almost a 1/4 of the 1st box I felt made up for it.
As a avid collector of baseball cards I felt it was a good buy and I would get a another one. This time I got one as a birthday gift. Let's just say I am glad this time my money wasn't used to purchase the item, but instead a gift card. Out of over 500 cards I recieved only 13 were rookies or inserts. The rest were just mostly complete sets of cards from the late 80s with mostly no names. I will give credit where it is due, I did recieve my one card from the 50s and 2 from the 60s as promised in the description as long as being shipped in a penny case then a hard case, to which I was very happy about. However, the 5 cards from the 1970s were not the best condition. The corners showed signs of rounding and wear. Of those 5 cards from the 70s, one was a checklist. If your not a true collector or want some vintage cards then buy it. Otherwise unless you need a paperweight or some kindle for fires, I'd stay away. This item is a GAMBLE. Caveat Emptor.",fair
81,Sports Collectibles,2021 Panini Prestige Football 30-Card Value Pack,$17.20,5,"Exactly what my 10 year old wanted, can’t find in stores, so he was happy!",positive
82,Sports Collectibles,2021 Panini Prestige Football 30-Card Value Pack,$17.20,3,I agree with another review. I'm assuming the sticker on the back that says 'like new' means these cards are re-packed or used. It seems dishonest to not mention that in the title.,fair
83,Sports Collectibles,2021 Panini Prestige Football 30-Card Value Pack,$17.20,5,"Happy with purchase, price, cards….",positive
