,cate,product,cost,review_star,review,tag
84,Sports Collectibles,2021 Panini Prestige Football 30-Card Value Pack,$17.20,5,Quality cards and some are shorter prints.,positive
85,Sports Collectibles,2021 Panini Prestige Football 30-Card Value Pack,$17.20,4,All came with the pack and was great.👍👍,positive
86,Sports Collectibles,2021 Panini Prestige Football 30-Card Value Pack,$17.20,5,This was a birthday gift and my grandson was pleased that he got some of his favorite player’s cards. Luck of the draw of course but he was very happy.,positive
87,Sports Collectibles,2021 Panini Prestige Football 30-Card Value Pack,$17.20,5,It’s hard to find affordable NFL cards. These are fairly priced for nice cards.,positive
88,Sports Collectibles,2021 Panini Prestige Football 30-Card Value Pack,$17.20,5,These were a hit with my collector!,positive
89,Sports Collectibles,2021 Panini Prestige Football 30-Card Value Pack,$17.20,1,"By the item description, I believed I was purchasing a sealed pack of Prestige cards but what I received was a pack that had already been opened. BUYER BEWARE!",negative
90,Sports Collectibles,2021 Panini Prestige Football 30-Card Value Pack,$17.20,1,"Website needs to appropriately describe the item as ""like new"" if its not actually new - never opened/resealed. For the price can't say I'd risk it, especially since I was getting this as a gift for someone else. Now I have to go to a card store or another big box store to make sure I get what I pay for.",negative
91,Sports Collectibles,2021 Panini Score NFL Football BLASTER box (11 pks/bx),$59.00,5,Nice to hand out sets of cards to random kids. Great donation for Police Stations as well.,positive
92,Sports Collectibles,2021 Panini Score NFL Football BLASTER box (11 pks/bx),$59.00,3,Decent cards wouldn’t say it was worth 62 bucks.,fair
93,Sports Collectibles,2021 Panini Score NFL Football BLASTER box (11 pks/bx),$59.00,5,"Great box of cards. Started this hobby up again with my nephew so I'm very satisfied with the pull. So glad, decided to buy another one. Thanks.",positive
94,Sports Collectibles,2021 Panini Score NFL Football BLASTER box (11 pks/bx),$59.00,4,My grandson should love them!,positive
95,Sports Collectibles,2021 Panini Score NFL Football BLASTER box (11 pks/bx),$59.00,4,"Great mix, not 1 duplicate but also not 1 autograph. Will def buy from this seller again, at least for 1 more pack ti see if any autographs arrive with that box. Cards are in mint condition and my son is loving them. Namath, Sanders, Rice, Howie Long and Terry Bradshaw to name a few of the great players he got.",positive
96,Sports Collectibles,2021 Panini Score NFL Football BLASTER box (11 pks/bx),$59.00,3,One thing you don’t EVER want is your cards to be damaged before you even touch them. The box was thrown around I’m guessing so I got a bunch of damaged cards :-/,fair
97,Sports Collectibles,2021 Panini Score NFL Football BLASTER box (11 pks/bx),$59.00,4,To summarize the whole thing it was a super good box but I didn’t get any Autographs I just got a limited nick Chubb which was still great to get,positive
98,Sports Collectibles,2021 Panini Score NFL Football BLASTER box (11 pks/bx),$59.00,4,It was a little to much money o think it should maybe be a little cheaper but it has no damage and i even got a tj hockenson patch card so that was cool and at least 3 rookies in each pack along with other players and cool cards.,positive
99,Sports Collectibles,2021 Panini Score NFL Football BLASTER box (11 pks/bx),$59.00,4,I liked that it was wrapped up nicely and not open and gift for any fanatic NFL,positive
100,Sports Collectibles,2021 Panini Score NFL Football BLASTER box (11 pks/bx),$59.00,5,"Well worth the $ got good Rookie cards and good current players as well Cedee Lamb, Patrick Queen and Jonathan Taylor as well definitely would buy again!",positive
101,Sports Collectibles,2021/22 Upper Deck MVP NHL Hockey BLASTER box (15 pks/bx),$29.99,5,Grandson LOVED these. Was thrilled with the cards he found inside.,positive
102,Sports Collectibles,2021/22 Upper Deck MVP NHL Hockey BLASTER box (15 pks/bx),$29.99,5,Happy customers. Would buy again. Recommend,positive
103,Sports Collectibles,2021/22 Upper Deck MVP NHL Hockey BLASTER box (15 pks/bx),$29.99,4,Hockey cards are so fun but a 2021-2022 pack with Jordan Eberle playing as an Islander is inaccurate.,positive
104,Sports Collectibles,2021/22 Upper Deck MVP NHL Hockey BLASTER box (15 pks/bx),$29.99,4,Son loved them,positive
105,Sports Collectibles,2021/22 Upper Deck MVP NHL Hockey BLASTER box (15 pks/bx),$29.99,5,Great value for a good set of cards,positive
106,Sports Collectibles,2021/22 Upper Deck MVP NHL Hockey BLASTER box (15 pks/bx),$29.99,1,Damaged like the legos I got for my grandzon..now it says I have to drive to retun... I'm old and this service is not working. Please take me off,negative
107,Sports Collectibles,2021-22 Panini Donruss Basketball Trading Card Blaster Box (88 Cards),$49.99,5,Not a bad value to add cards to your collection.,positive
108,Sports Collectibles,2021-22 Panini Donruss Basketball Trading Card Blaster Box (88 Cards),$49.99,3,"Disappointed in my cards.
Not worth the money.",fair
109,Sports Collectibles,2021-22 Panini Donruss Basketball Trading Card Blaster Box (88 Cards),$49.99,5,Product was new as described .,positive
110,Sports Collectibles,2021-22 Panini Donruss Basketball Trading Card Blaster Box (88 Cards),$49.99,5,Nice cards,positive
111,Sports Collectibles,2021-22 Panini Donruss Basketball Trading Card Blaster Box (88 Cards),$49.99,1,"Only parallels. No numbered or auto or patch

Sucks

I know its not a guaranteed chance, but out of 11 packs and 88 cards, I didn’t get ONE numbered card",negative
112,Sports Collectibles,2021-22 Panini Donruss Basketball Trading Card Blaster Box (88 Cards),$49.99,1,Worst blaster ever,negative
113,Sports Collectibles,2021-22 Panini Donruss Basketball Trading Card Blaster Box (88 Cards),$49.99,1,"I bought it a few times. This is the first time the problem occurred. All the cards are junk and are horrible. Don't buy it, it is a resale from the target.",negative
114,Sports Collectibles,2021-22 Panini Donruss Basketball Trading Card Blaster Box (88 Cards),$49.99,1,The product was very badly damaged,negative
115,Sports Collectibles,2021-22 Panini Donruss Basketball Trading Card Blaster Box (88 Cards),$49.99,5,so good kids loved it,positive
116,Sports Collectibles,2021-22 Panini Donruss Basketball Trading Card Blaster Box (88 Cards),$49.99,1,Terrible cards. Came damaged. Cards all damaged,negative
117,Sports Collectibles,2021 Panini Score Football Jumbo Fat Pack Sealed 40 Card Pack - Look for Trevor Lawrence and Justin Fields Rookie and Autograph Cards,$21.19,3,Bought one pack. Got a Fields rookie and Pitts rookie along with a Brady insert. Not much value but okay cards. Overpriced of course,fair
118,Sports Collectibles,2021 Panini Score Football Jumbo Fat Pack Sealed 40 Card Pack - Look for Trevor Lawrence and Justin Fields Rookie and Autograph Cards,$21.19,5,"It’s very good I got a Brett Favre good card, J’Mar Chase, Najee Harris and a Justin Fields rookie card",positive
119,Sports Collectibles,2021 Panini Score Football Jumbo Fat Pack Sealed 40 Card Pack - Look for Trevor Lawrence and Justin Fields Rookie and Autograph Cards,$21.19,5,Nice selection.,positive
120,Sports Collectibles,2021 Panini Score Football Jumbo Fat Pack Sealed 40 Card Pack - Look for Trevor Lawrence and Justin Fields Rookie and Autograph Cards,$21.19,5,As a gift for my granson.,positive
121,Sports Collectibles,2021 Panini Score Football Jumbo Fat Pack Sealed 40 Card Pack - Look for Trevor Lawrence and Justin Fields Rookie and Autograph Cards,$21.19,3,it came in SUPER late but the product is good,fair
122,Sports Collectibles,2021 Panini Score Football Jumbo Fat Pack Sealed 40 Card Pack - Look for Trevor Lawrence and Justin Fields Rookie and Autograph Cards,$21.19,1,"This is not what is advertised. You will get SCORE cards, not Panini Donruss. Huge disappointment and wish I didn't open the package. Never ordering again.",negative
123,Sports Collectibles,2021 Panini Score Football Jumbo Fat Pack Sealed 40 Card Pack - Look for Trevor Lawrence and Justin Fields Rookie and Autograph Cards,$21.19,1,"Not the product in the photo , click bate . The pack of cards in the photo are much better than the ones sent. Will be sending back",negative
124,Sports Collectibles,2021 Panini Score Football Jumbo Fat Pack Sealed 40 Card Pack - Look for Trevor Lawrence and Justin Fields Rookie and Autograph Cards,$21.19,1,Did not get what was in the picture. & yes I did read the description did not see it was a Score pack. . Trash,negative
125,Sports Collectibles,2021 Panini Score Football Jumbo Fat Pack Sealed 40 Card Pack - Look for Trevor Lawrence and Justin Fields Rookie and Autograph Cards,$21.19,1,,negative
126,Sports Collectibles,2021 Panini Score Football Jumbo Fat Pack Sealed 40 Card Pack - Look for Trevor Lawrence and Justin Fields Rookie and Autograph Cards,$21.19,1,The product pictured is a Donruss pack. The pack you get is a Score pack. Misleading advertising.,negative
127,Sports Collectibles,2022 Panini Prizm UFC BLASTER box (6 pks/bx),$34.98,4,The items box was damaged but the contents were fine.,positive
128,Sports Collectibles,2022 Panini Prizm UFC BLASTER box (6 pks/bx),$34.98,5,"Good selection of cards including multiple rookies, cards are nice looking silver prizms. Order came within 24 hours.",positive
129,Sports Collectibles,2022 Panini Prizm UFC BLASTER box (6 pks/bx),$34.98,5,is what it says,positive
130,Sports Collectibles,2022 Panini Prizm UFC BLASTER box (6 pks/bx),$34.98,1,Don’t order if you collect the box came all bent. The cards had creases in them as well.,negative
131,Sports Collectibles,2022 Panini Prizm UFC BLASTER box (6 pks/bx),$34.98,1, I paid top dollar for these packs. They all came damaged,negative
132,Sports Collectibles,2022 Panini Prizm UFC BLASTER box (6 pks/bx),$34.98,5,Great selection,positive
133,Sports Collectibles,NBA Superstar- (50) Card Pack NBA Basketball Superstars Starter Kit all Different cards. Comes in Custom Souvenir Case! Perfect for the Ultimate NBA Fan! by 3bros,$13.99,4,Probably my misunderstanding but I thought that they would be packaged in groups of 10 so five packages but it was one large package of 50. Still love the product,positive
134,Sports Collectibles,NBA Superstar- (50) Card Pack NBA Basketball Superstars Starter Kit all Different cards. Comes in Custom Souvenir Case! Perfect for the Ultimate NBA Fan! by 3bros,$13.99,3,"I love the variety of brands that’s in the box. You can unfortunately tell this looks like some collectors who had unwanted cards packed up and resold, because the only cards that was an actual superstar was James Worthy, Rajon Rondo, and Ronaldo Blackman. Every other card was ok to who is this player again. It was cheap enough though, so that’s why I rated it a 3.",fair
135,Sports Collectibles,NBA Superstar- (50) Card Pack NBA Basketball Superstars Starter Kit all Different cards. Comes in Custom Souvenir Case! Perfect for the Ultimate NBA Fan! by 3bros,$13.99,4,I got a bunch of great cards. The best was a Lonzo ball Rookie card,positive
136,Sports Collectibles,NBA Superstar- (50) Card Pack NBA Basketball Superstars Starter Kit all Different cards. Comes in Custom Souvenir Case! Perfect for the Ultimate NBA Fan! by 3bros,$13.99,3,"My 12 yo son really wanted these so he gave me the money to purchase them. He's happy enough with the cards, but he counted 3 times and only received 49 of the 50.",fair
137,Sports Collectibles,NBA Superstar- (50) Card Pack NBA Basketball Superstars Starter Kit all Different cards. Comes in Custom Souvenir Case! Perfect for the Ultimate NBA Fan! by 3bros,$13.99,4,Everything was great.,positive
138,Sports Collectibles,NBA Superstar- (50) Card Pack NBA Basketball Superstars Starter Kit all Different cards. Comes in Custom Souvenir Case! Perfect for the Ultimate NBA Fan! by 3bros,$13.99,4,"The package was opened and some cards were worn. It as if some went through the pack, took the cards they wanted and replaced with cards they didn’t want",positive
139,Sports Collectibles,NBA Superstar- (50) Card Pack NBA Basketball Superstars Starter Kit all Different cards. Comes in Custom Souvenir Case! Perfect for the Ultimate NBA Fan! by 3bros,$13.99,2,"I was expecting to receive several packs of cards, the picture clearly displays multiple packages of basketball cards. A single pack was delivered. I understand the pack includes the 50 cards ordered. My disappointment came from the confusion between pictured item and actual product.",negative
140,Sports Collectibles,NBA Superstar- (50) Card Pack NBA Basketball Superstars Starter Kit all Different cards. Comes in Custom Souvenir Case! Perfect for the Ultimate NBA Fan! by 3bros,$13.99,5,I loved it it was so nice and very nice cards I got so many good cards and no duplicates,positive
141,Sports Collectibles,NBA Superstar- (50) Card Pack NBA Basketball Superstars Starter Kit all Different cards. Comes in Custom Souvenir Case! Perfect for the Ultimate NBA Fan! by 3bros,$13.99,1,Came with damage. Horrible cards.,negative
142,Sports Collectibles,NBA Superstar- (50) Card Pack NBA Basketball Superstars Starter Kit all Different cards. Comes in Custom Souvenir Case! Perfect for the Ultimate NBA Fan! by 3bros,$13.99,5,Love the cards and deal.,positive
143,Sports Collectibles,2021 Panini Prestige NFL Football BLASTER box (64 cards/bx) Look for Blaster Exclusive Diamond Parallel and Memorbilia Cards,$44.99,4,"Box appeared to be factory sealed but honestly I'm not sure because there was a huge yellow sticker on the side that said once seal was broken it was non returnable. Sticker placement was not ideal for gifting. Box was expensive but my son enjoyed opening the different packs. Overall if I didn't need it as a Christmas gift, I wouldn't have purchased.",positive
144,Sports Collectibles,2021 Panini Prestige NFL Football BLASTER box (64 cards/bx) Look for Blaster Exclusive Diamond Parallel and Memorbilia Cards,$44.99,4,I shopped around for football cards and gifted them to my son. He really enjoyed opening them and the excitement hoping to get some players he didn’t have yet. Collectible cards but not a lot of new players. Great for a kid that collects and is just getting into collecting cards.,positive
145,Sports Collectibles,2021 Panini Prestige NFL Football BLASTER box (64 cards/bx) Look for Blaster Exclusive Diamond Parallel and Memorbilia Cards,$44.99,5,"Bought these for my 12 yr old. Shipping was fast and there was no tampering with the actual product bc it arrived with the original plastic packaging wrapped around the box. Tons of cards for my kid and the cards have players from the last draft as well. My kid loved not only getting cards of current players but also of former players (and current HOF people as well). Overall, great purchase for the price!!",positive
146,Sports Collectibles,2021 Panini Prestige NFL Football BLASTER box (64 cards/bx) Look for Blaster Exclusive Diamond Parallel and Memorbilia Cards,$44.99,5,shipping was super fast and the box came sealed and in great condition. very happy with the product,positive
147,Sports Collectibles,2021 Panini Prestige NFL Football BLASTER box (64 cards/bx) Look for Blaster Exclusive Diamond Parallel and Memorbilia Cards,$44.99,5,Thank you for the footbll packs!,positive
148,Sports Collectibles,2021 Panini Prestige NFL Football BLASTER box (64 cards/bx) Look for Blaster Exclusive Diamond Parallel and Memorbilia Cards,$44.99,5,"It's a game of chance but of the box good, got a time stamped ceedee lamb, but also got a time stamped ceedee lamb gold parrell #14/99.",positive
149,Sports Collectibles,2021 Panini Prestige NFL Football BLASTER box (64 cards/bx) Look for Blaster Exclusive Diamond Parallel and Memorbilia Cards,$44.99,5,My grandson loved them,positive
150,Sports Collectibles,2021 Panini Prestige NFL Football BLASTER box (64 cards/bx) Look for Blaster Exclusive Diamond Parallel and Memorbilia Cards,$44.99,5,"Pulled a Mac jones rookie card and Jaycee Horne numbered. Overall a solid pack, but a little expensive.",positive
151,Sports Collectibles,2021 Panini Prestige NFL Football BLASTER box (64 cards/bx) Look for Blaster Exclusive Diamond Parallel and Memorbilia Cards,$44.99,2,"These cards are NOT new! Sticker on the product indicates “like new”. As you can see from the product description, this is not made clear. $50 for used cards is insane! Unfortunately this is a Christmas gift and I don’t have time to look for a replacement. I’m giving it 2⭐️ instead of 1 ⭐️ simply because my 14 year old son is still pleased and looking forward to giving them to his cousin.",negative
152,Sports Collectibles,2021 Panini Prestige NFL Football BLASTER box (64 cards/bx) Look for Blaster Exclusive Diamond Parallel and Memorbilia Cards,$44.99,2,Received damaged received a 1 of 1 card in a pack and it is damaged. Pretty disappointed,negative
153,Sports Collectibles,2021 Panini Prizm Draft Football BLASTER box (6 pks/bx),$35.99,4,"This box is all rookie draft prism cards, every single card. All these cards I'm talking about are rookie/draft prism cards. That's all that's in this box. For thirty rookie draft cards alone this would be a perfect price, but this is much more than a normal rookie draft box.
This box includes rookies not only from this year but rookies that have been drafted as far as years ago. This gives you the chance to get the most infamous rookies draft cards from multiple drafts which makes this box really good value. This box, for me, yielded cards from Justin fields all the way back to Philip rivers.
This box also gives many very good cards. This box gave me the most hits I've ever seen in a normal-sized box. This isn't like those other boxes that drown 1 decent or good card in a pack of 6 other trash cards, with six packs per box. This box has at least just as many good cards as bad, and mine actually had more. I got 17 great cards, meaning big names, compared to just 13 bad cards. Each pack had a guaranteed All American Draft prism and another special prizm.
Many other reviews I've seen on this product mention the fact that these cards arrive warped. This is not because of damaging shipping. This is not because the cards are cheap or poorly made, low value, harshly handled, or any kind of faulty production. This is naturally because of the material used to make the shiny surfaces of the cards, it naturally warps cards slightly. This does not take away from the value, it does not make the cards less valuable than other cards, it is just normal and still does grant a perfect 10 if you get the card graded in perfect condition, just the same way as literally any other trading card.

I got many exciting cards from just this one box:
- all American justin fields, prism draft picks, rookie
- green prism Patrick Mahomes II, prism draft picks
- Will Fuller V, prism draft picks
- Myles Garret, prism draft picks
- Justin Herbert, prism draft picks
- Crusade Micah Parsons, prism draft picks, rookie
- Green Circles Prism Tyreek Hill, prism draft picks [03/25]
- Rainbow Silver Prism Tylan Wallace, prism draft picks, rookie (WR drafted 4th round to the Ravens)
- Jarvis Landry, prism draft picks
- Josh Allen, prism draft picks (QB)
- Green Prism Davante Adams, prism draft picks
- Travis Kelce, prism draft picks
- Crusade Ja'marr Chase, prism draft picks, rookie
- Purple Wave Prism Rashod Bateman, prism draft picks, rookie
- Philip Rivers, prism draft picks
- Tyreek Hill, prism draft picks
- Saquon Barkley, prism draft picks",positive
154,Sports Collectibles,2021 Panini Prizm Draft Football BLASTER box (6 pks/bx),$35.99,5,My son loves these cards,positive
155,Sports Collectibles,2021 Panini Prizm Draft Football BLASTER box (6 pks/bx),$35.99,5,Box was sealed and pristine when I received it.,positive
156,Sports Collectibles,2021 Panini Prizm Draft Football BLASTER box (6 pks/bx),$35.99,4,The cards were nice but about half of them were bent or curved the card box was beat up on the outside,positive
157,Sports Collectibles,2021 Panini Prizm Draft Football BLASTER box (6 pks/bx),$35.99,5,"After being a little skeptical about buying cards from Amazon,I gotta say I was pleasantly surprised. The box came in perfect condition and factory sealed. We pulled some good cards. I recommend this product because I love prizm and now days you cannot find cards in store. So Amazon is the way to go for this particular product unless you find at retail price.",positive
158,Sports Collectibles,2021 Panini Prizm Draft Football BLASTER box (6 pks/bx),$35.99,3,"The cards are good looking cards and nice to have in a collection. But what I was surprised about and somewhat disappointed in, was the packs, including the cards, are all bowed or arched, as one my say, and a few had creases in them. Collector cards are not cheap anymore. I would expect the cards to be in their original condition. I'm sure that this will take away some of their value.",fair
159,Sports Collectibles,2021 Panini Prizm Draft Football BLASTER box (6 pks/bx),$35.99,3,Bought 3 boxes of these. The first and third box I opened were complete duplicates. Same exact players and even the nicer cards were the same. Disappointing. I like the Cards good value but don’t buy more than one box or you could end up getting the same exact cards,fair
160,Sports Collectibles,2021 Panini Prizm Draft Football BLASTER box (6 pks/bx),$35.99,3,You figure you pay all that money for six packs and you think you would get a decent card. The box was a very big disappointment. WOW!!!,fair
161,Sports Collectibles,2021 Panini Prizm Draft Football BLASTER box (6 pks/bx),$35.99,5,Birthday present for grandson. Am sure he will enjoy!,positive
162,Sports Collectibles,2021 Panini Prizm Draft Football BLASTER box (6 pks/bx),$35.99,3,All cards came warped,fair
163,Sports Collectibles,2022 Topps Series 2 Factory Sealed Hanger Box with 67 Cards including Possible Rookies Autographs and Jersey Cards,$32.99,5,"Product easy to work with, good price",positive
164,Sports Collectibles,2022 Topps Series 2 Factory Sealed Hanger Box with 67 Cards including Possible Rookies Autographs and Jersey Cards,$32.99,1,Topps prints it’s name on its seal and has manufacturers stickers on it to prove. I have a factory sealed box in pictures for example!,negative
165,Sports Collectibles,2021 Panini Donruss NFL Football BLASTER Box (11 Pks/Box),$68.44,5,Pulled me a Derrick Henry Downtown and lots of great rookie QB's. Would definitely buy again,positive
166,Sports Collectibles,2021 Panini Donruss NFL Football BLASTER Box (11 Pks/Box),$68.44,3,The box I ordered had no big hits. The insert Kyle Pitts rookie revolution was the big draw. Nice card but no value the most value card in the whole blaster box was the rated rookies Najee Harris base. Also Aaron Donald all action pros ( no value). I was foolish and watched the YouTube box reveal and don't be duped folks those pulls are extremely rare and as I explained this box was extremely mediocre in fact the prestige and contenders same year were superior and much more to my liking having bought all 3. Unimpressed for $70!😐,fair
167,Sports Collectibles,2021 Panini Donruss NFL Football BLASTER Box (11 Pks/Box),$68.44,5,Good,positive
168,Sports Collectibles,2021 Panini Donruss NFL Football BLASTER Box (11 Pks/Box),$68.44,3,"Blaster boxes are fun to open, but, don’t expect to get any good out of these boxes. I got a Justin fiend rated rookie, that’s about the best card. No auto or numbered card, or auto card. I didn’t not get any special card other than a power charge card of George kittle, not that impressed.",fair
169,Sports Collectibles,2021 Panini Donruss NFL Football BLASTER Box (11 Pks/Box),$68.44,5,Got this box for my husbands birthday and we pulled a trey Vance downtown! 😍,positive
170,Sports Collectibles,2021 Panini Donruss NFL Football BLASTER Box (11 Pks/Box),$68.44,1,"Was super excited to received this packaged from Amazon. What I received were 90% base cards, no optic rated rookies, not a single card values $5. This is definitely a repacked box. Do not buy this product. If only I could rate a zero star, I would in a heart beat.",negative
171,Sports Collectibles,2021 Panini Donruss NFL Football BLASTER Box (11 Pks/Box),$68.44,5,Awesome rookies.,positive
172,Sports Collectibles,2021 Panini Donruss NFL Football BLASTER Box (11 Pks/Box),$68.44,5,Pulled an Alvin Kamara DOWNTOWN!,positive
173,Sports Collectibles,2021 Panini Donruss NFL Football BLASTER Box (11 Pks/Box),$68.44,1,Perfect for a kid that does not care about value. For an adult - Waste of money.,negative
174,Sports Collectibles,2021 Panini Donruss NFL Football BLASTER Box (11 Pks/Box),$68.44,5,Item arrived earlier than expected and was exactly as described. Great stocking stuffer for my husband! He was happy with a Mac Jones rated rookie and a Justin Fields 'out of this world'.,positive
175,Sports Collectibles,2022 Topps Series 2 Baseball Hobby Box (24 Packs/14 Cards 1 Silver Pack),$112.79,5,"I had some really good pulls. 1 auto , 4 numbered cards & 1 photo variation short print. I’ve had better but I’ve also had worse. Overall I would buy from them again because my nearest card shop is an hour away.",positive
176,Sports Collectibles,2022 Topps Series 2 Baseball Hobby Box (24 Packs/14 Cards 1 Silver Pack),$112.79,5,Love series 1 and 2. I wish it was 1 auto 1 Memo per box but it's the fun of ripping packs so it is what it is. Great hits in my boxes.,positive
